Word	POS	BNC Rank	Google Rank	IPA	Conjugations	Synonyms	Arabic	Chinese	German	Greek	English	French	Italian	Japanese	Korean	Dutch	Portuguese	Russian	Spanish	Swedish	Thai	Turkish
lateral	adj.	17195	10713	lˈætɜəl	laterals	tangential side unencumbered cross creative imaginative unfettered sideways agile	جانبي	N/A	seitlich, Seiten-; von der Seite; zur Seite hin; quer	πλάγιος, πλευρικός	of or pertaining to the side; coming from the side; aimed towards the side; moving from side to side, moving in a sideways manner	latéral; du coté; transversal	laterale, di lato, di fianco	横の; 横からの; 横に向かっている; 側音の	옆의, 옆으로의; 옆으로 움직이는	aan/vanaf/naar de zijkant	lateral; do lado; de lado; pelo lado; ao lado	боковой, латеральный; продольный, горизонтальный; вторичный, побочный	lateral, del costado	sido-; sidoställd; latitud-; vid sidan; från sidan	เกี่ยวกับด้านข้าง	yanal, yan
layout	n.	8108	4317	lˈeɪˌaʊt	N/A	outline explain blueprint describe arrangement present design draft design landscape plan arrange outline plan organize	تفسير, تصميم, نموذج, نسق, مصصم, نظام تخطيط	布局, 陈列, 规划图, 页面布局, 版面编排	Anordnung; Anlage, Plan; Aufmachung, Umbruch; Layout	σχέδιο	arrangement, plan; act of laying or spreading out; sketch, plan, drawing; something which has been arranged or laid out	disposition, formation; arrangement; planification; plan, esquisse; composition; assortiment	tracciato, progetto; (Tip, Fot) disposizione; (Ind) schema di lavoro, layout; (Topogr) schema planimetrico; bozzetto, schizzo; corredo	計画; 横にすること; 設計; 設計図; 割り付け	배치, 계획, 설계; 펼치기; 그리기, 초안 그리기; 배치된 것	indeling, ontwerp, bouwplan; opmaak, lay-out	plano; esboço; equipamento; condições; mesa de jogo; sistema	показ, план, выставка; планировка, оборудование; размещение, расположение	croquis, diseño, esquema, plan, planteo, trazado; arreglo, disposición	uppställning; utformning; planering; layout, plan, schema, skiss; arrangemang; utrustning, uppsättning	โครงงาน แผนงาน	düzenleme, düzen, plan, örtü, kumar masası örtüsü
leaf	n.	6768	5028	lˈif	leaves leafs leafed leafing	sheet folio side	ورقة نبات, صفحة ورق, سعف النخل, قرطاس, رقاق, صحيفة, صفيحة	叶, 树叶, 花瓣, 页	Blatt; Laub; Folie; Schicht; Flügel; dünne Metallplatte (insbesondere aus Gols oder Silber); bewegliches Teil; Extrastück zur Tischverlängerung	φύλλο	flat and usually green structure attached to the stem or branch of a plant; foliage; petal; state of having leaves; page; layer; thin sheet of metal (especially gold or silver); hinged or movable part; extra section added to extend a table's length	feuille d'une branche ou d'une plante, pétale; feuillage; page, feuille, feuillet (livre); rallonge (table); feuille de métal (argent ou or); aile; battant, vantail, panneau (paravent, porte)	foglia; petalo; (collett) fogliame, foglie, fronde; foglio; pagina; lamina; ribalta; battente	葉っぱ, 葉; 花びら; 葉があること; ページ; 層; 薄い金属（特に金や銀）; 蝶番; テーブルの足の延長部分	잎, 잎사귀; 잎들; 한장; 층; 금속판 ( 특히 금이나 은의); 용수철판; 자재판, 도개교	blad, vlakke en ongewone structuur aan de stam of tak van een plant; kroonbloem; gebladerte; blad (papier); laag; dunne laag metaal (speciaal goud of zilver); vleugel; extra tafelblad om tafel te verlengen	folha; papelucho de propaganda; lâmina; página; placa; chapa; camada, estrato	лист, листва; чайный лист; листовой табак; страница; листовка; лист металла; створка; полотнище, опускная доска; крыло, половинка	hoja; fronda, follaje; lámina; página; batiente	löv; blad; blad (i bok); tunt blad; folie; metallfolie; klaff, skiva	หน้าหนังสือ หน้ากระดาษ	yaprak, sayfa, kanat (masa), folyo
lecturer	n.	8609	10902	lˈɛktʃɜɜ	lecturers	N/A	محاضر, المدرس المحاضر	演讲者, 讲师	Vortraggeber; Vortragende; Hilfsprediger; Dozent	ομιλητής, υφηγητής, λέκτορας	one who lectures; professor at an academic institution	conférencier; orateur	conferenziere, oratore; (Univ) professore incaricato; (am; Univ) lettore; (Rel) predicatore	講義者; 講師	강사, 가르치는사람; 교수	spreker, houder v. lezing; docent (in het hoger onderwijs)	conferencista; professor acadêmico	лектор, преподаватель, доцент	conferencista, charlista, conferenciante, expositor, lector, orador; catedrático, profesor de universidad	föreläsare; lektor	ผู้บรรยาย	konuşmacı, okutman
legend	n.	6794	4041	lˈɛdʒənd	legends	N/A	أسطورة, خرافة, نقش على العملة, شخص يلهم الأساطير, عنوان تفسيرى	传说, 传奇文学, 图例	Legende; Sage; Erklärung	μύθος, θρύλος	story that has been handed down over generations and cannot be proved to be true or fictitious, tale, myth, fable; collection of myths or fables; explanatory table for a map (or chart, etc.); inscription (on a coin, monument, etc.)	légende, mythe; recueil de contes; légende d'une carte; inscription (sur une pièce, une statue)	leggenda; (collett) leggende; leggendario; mito; legenda, iscrizione, motto; didascalia	伝説; 神話; 伝説文学; 伝説的人物; 銘（コインや記念碑など）	전설, 수세대에 걸쳐 내려오는 사실임을 증명할 수 없는 이야기; 동화, 우화, 신화; 신화나 우화집; 삽화나 지도등의 해설; 동전이나 기념메달 등의 제명	legende; mythe; verklaring van tekens op kaart (atlas); tekst (op muntstuk, monument)	lenda; legenda; rótulo; dístico; tabela; letreiro; história	надпись, легенда, поверье	leyenda; fábula; saga; cuento popular, mito; inscripción, letrero; narración	legend; helgonhistoria; saga; sägn, myt; inskription (på mynt, medalj etc.)	เรื่องราวของบุคคลหรือเหตุการณ์ที่มีชื่อเสียง เรื่องราวของบุคคลที่น่าสนใจ	efsane, mit, yazıt, kitabe
legitimate	adj.	5657	8065	lədʒˈɪtəmət	legitimates legitimated legitimating	N/A	شرعي, منطقي, قانوني	N/A	legitim; kosher; rechtmäßig; wahrhaftig; logisch; legitim	νόμιμος, θεμιτός	legal, lawful; acceptable; justified; reasonable, logical; born of parents who are legally married; correct, sound; authorized	légitime; légal; véritable; logique	legittimo, legale; giustificato; (Teat) regolare	合法の; 納得できる; 正当化された; 道理に合った; 嫡出の; 合理的な; 本格的な; 正しい; 認められた	합법의, 적법한; 받아들여 지는, 용인되는; 정당한; 합리적인; 적출의; 옳은; 권한을 받은, 승인받은	wettelijk; koosjer; terecht; echt; logisch; legitiem	legítimo; correto, de acordo com as leis; justificado; verdadeiro; lógico	законнорожденный, законный, легальный, правильный, разумный	legítimo, auténtico, conforme a derecho, legal, legitimario, lícito	laglig; legitim; rättmätig; befogad; rimlig; välgrundad; berättigad	N/A	yasal, meşru, mantıklı, akla uygun, yerinde, haklı, soydan gelen
leisure	n.	3430	3290	lˈɛʒɜ	N/A	N/A	فارغ, راحة, فراغ, وقت الفراغ, هوينا	空闲, 闲暇, 悠闲	Muße, Freizeit	σχολή, άνεση, ελεύθερος χρόνος, ανάπαυση	time free from work or other demands and duties, free time; rest; recreation	loisirs, temps libre, loisir	agio, comodo; tempo	レジャー, 暇, 余暇; 休憩; 気分転換	여가, 여가시간; 휴식; 레크레이션	vrij; (vrije) tijd; ontspannen	lazer, descanso, tempo livre, ócio	досуг, свободное время	ocio, desocupación, esparcimiento, holganza, solaz, tiempo libre	fritid, ledighet, lediga stunder	เวลาว่าง การว่างจากงาน	boş vakit, uygun zaman, acelesi olmama
lever	n.	15745	12421	lˈɛvɜ	levers levered levering	knob handle switch ease bar wrench push prize pedal lift force	رافعة, عتلة, مخل, مقبض	杠杆, 似杠杆之工具	Hebel	μοχλός, λοστός	simple machine consisting of a rigid bar which pivots on a fixed point and is used to raise or move an object on one end by applying force to the other; handle; means of accomplishing something	levier; perche; pédale	leva; palanchino, piede di porco	てこ; レバー	지레, 지렛대; 수단; 어떤 것을 달성하는 방법	kraan; hefboom, koevoet; pedaal	alavanca; bastão; pedal	рычаг, рукоятка, вага, плечо рычага, гандшпуг, средство воздействия	palanca, alzaprima, barra	hävstång; spak; pedal	ชะแลง เหล็กงัด	kaldıraç, manivela, lövye
lexical	adj.	7574	20967	lˈɛksɪkəl	N/A	N/A	معجمي, قاموسي, مفرداتي	N/A	lexikalisch	λεξιλογικός	of or pertaining to a language's words or vocabulary; of or pertaining to a lexicon, of a dictionary	lexical; relatif aux mots ou au vocabulaire; relatif au lexique, qui appartient au dictionnaire	lessicale	単語の; 辞書の	어휘의; 사전의, 어휘사전의	woordelijk; van woorden; van woordenschat	do dicionário; das palavras; do léxico; lexical	лексический, словарный	léxico, relativo a las palabras	lexikalisk; ord-; lexikon-; angående lexikon	เกี่ยวกับคำหรือศัพท์	sözcüklere ait, sözlük
liable	adj.	4187	5363	lˈaɪəbəl	N/A	answerable likely prone apt predisposed responsible accountable	عرضة, خاضع, مسؤول قانونيا, مدين	N/A	schuldig; verantwortlich, verantwortungsbewußt; verpflichtet; könnte...; gemacht für; für; zu erwarten	υποκείμενος, υπεύθυνος, υπόλογος, υπαίτιος	under legal obligation; responsible; likely, prone; susceptible, subject to	responsable; tenu, astreint à; redevable, passible; apte, enclin à	soggetto, obbligato, tenuto; portato, che ha tendenza; (Dir) responsabile	…しがちな; かかりやすい; 責任がある	책임을 져야 할; 법률상 책임을 져야 할; ...에 처해져야 할; ...하기 쉬운, ...할 것 같은, ...의 경향이 있는	schuldig; verantwoordelijke; is verantwoordelijk; verplicht; is in staat om-(meestal in negatieve zin); bestemd voor- (in negatieve zin); -staat hem te wachten	devedor; responsável, aquele que responde por algo; endividado; que tende a-; que pode-; suscetível a-; cujo futuro é-	обязанный, ответственный, подлежащий, подверженный, вероятный, возможный, доступный	responsable, propenso, sujeto, susceptible	skyldig; avsvarig, ansvara för; skyldig; benägen att; fallen för att göra något; disponerad att göra något; mottaglig för	ที่มีแนวโน้ม ที่โน้มเอียง	sorumlu, olası, mesul, yükümlü, eğilimli, duyarlı, muhtemel
lifestyle	N/A	7641	3365	lˈaɪfstˌaɪl	N/A	N/A	N/A	N/A	N/A	N/A	N/A	N/A	N/A	N/A	N/A	N/A	N/A	N/A	N/A	N/A	N/A	N/A
lifetime	n.	4964	4746	lˈaɪftˌaɪm	lifetimes	period time time era days duration generation life existence	حياة, حياة المرء, عمر الأيون	一生, 终生	Lebenszeit, ein Leben lang; ein Menschenleben lang	όλη η ζωή, διάρκεια ζωής	span of a person's life, time during which a person is alive; period of time during which something functions or exists	vie; durée de vie, longévité	durata di tutta una vita; (fam) eternità, secolo	生涯; 寿命	일생; 수명	levenslang; levensduur; gedurende het menselijk leven	uma vida inteira, toda uma vida; duração da vida de um ser humano	продолжительность жизни, целая жизнь	duración de una vida, época de vida, era	livstid, ett helt liv; hela livet	เวลาที่ยาวนาน	hayat, ömür, yaşam
likelihood	n.	6999	9476	lˈaɪklihˌʊd	likelihoods	N/A	أرجحية, احتمال, ترجح	可能, 可能性	Wahrscheinlichkeit, Chance; Möglichkeit; Wahrscheinlichkeit	πιθανότης, πιθανότητα	probability, chance, feasibility, possibility	vraisemblance, probabilité, apparence	probabilità, verosimiglianza	ありそうなこと, 可能性, 機会	있을 수 있는 일, 가능성	aannemelijkheid; kans; mogelijkheid; in staat zijn om	probabilidade, possibilidade, chance; predisposição	вероятность, многообещающая будущность	probabilidad, chance, posibilidad; verosimilitud	sannolikhet, rimlighet, möjlighet; antagligen	ความเป็นไปได้	olası olma, olasılık, ihtimal
likewise	adv.	7576	9395	lˈaɪkwˌaɪz	N/A	equally too also similarly	أيضا, كذلك, فوق ذلك, بطريقة مماثلة	N/A	zusätzlich; auch; und auch; wie auch; ähnlich; gleich	επίσης, όμοιος, παρομοίως	in addition, also, too, as well; in the same manner, similarly	également, de même, de façon analogue	nello stesso modo, altrettanto, similmente, in modo analogo; anche, inoltre, in aggiunta	同様に; …もまた; 同じく	마찬가지로, 그리고 또한	evenzo; des-, insgelijks, eveneens, ook	da mesma forma, igualmente, do mesmo modo; também; semelhantemente	также, подобно, более того	asimismo, a tenor, análogamente, así mismo, de igual modo, igualmente, ítem	även, också; dessutom, därtill, tillika; på samma sätt, likaledes, sammaledes; samma sak, detsamma	ในทำนองเดียวกัน เช่นเดียวกัน, อย่างเดียวกัน	aynı şekilde, hem, ayrıca, dahi
limb	n.	13192	15890	lˈɪm	limbs limbed limbing	N/A	فرع شجرة, عضو إنسان, كان معزول, الحاشية المدرجة, غموض الفكر البشري	四肢, 枝干, 翼, 边缘	(Körper) Glied; Ast; Rang; Rand; Sprache; Flügel	μέλος του σώματος, άκρο, κλώνος δέντρου, μέλος	large or main branch of a tree; projecting jointed appendage of the body (arm, leg, wing, etc.); part which projects outward; mischievous child (Slang)	membre; aile; bras; jambe; branche, rameau; voyou (Argot - Familer); extrémité, bord	(Anat) arto; ramo; (fig) braccio; (fig) componente, membro	手足; 翼; 大枝; わんぱく坊主	큰가지; 수족; 갈라져 나온 부분; 개구장이, 장난꾸러기(속어)	lid(maat); arm, been, (dikke/grote) tak (v. boom)	membro (do corpo); limbo (de instrumento, de astro); braço; perna; asa; tronco principal (árvore); extremidade; levado (gíria)	конечность, член; ветвь, сук, ветка; орган, лимб, часть, диск	extremidad, miembro, pierna; rama	lem; organ; arm; ben; trädgren (stor); rackare (slang); kant, rand, gräns	ขอบ ริม	uzuv, kol, bacak, kanat, şube, bent, yaramaz çocuk
linear	adj.	6577	3316	lˈɪniɜ	N/A	N/A	مؤلف من خطوط, طولي, خطي, خيطي	N/A	geradlinig, linear; Längen-; dünn und lang; strichähnlich	γραμμικός, επιμήκης	straight; one dimensional; pertaining to length; involving or resembling lines; narrow and elongated; involving linear functions or equations (Mathematics)	linéaire; unidimensionnel; longitudinal; en forme de ligne; étroit et longue	lineare	線の; 線を用いた; 線状の; 長さの; 一次の	직선의; 1차의; 선모양의; 길이의; 가느다랗고 긴; 1차방정식의	lineair, recht(lijnig); lengtemaat	linear; unidimensional; referente ao comprimento; tracejado; estreito e comprido	линейный, узкий и длинный	lineal, linear, longitudinal	linjeformig; endimensionell; linjär, lineär; linje-, linear-; lång och smal	เป็นเส้นตรง เป็นแนวตรง, เป็นแนวยาว	çizgisel, doğrusal, birinci derece, linear
linguistic	adj.	3885	12180	lɪŋgwˈɪstɪk	N/A	N/A	لغوي, ملم بلغات عديدة	N/A	linguistisch	γλωσσολογικός, γλωσσικός	of language; of linguistics, of the scientific study of language	linguistique; relatif à la linguistique	linguistico; glottologico	ことばの; 言語学の	언어학의; 언어의	taalkundig	lingüístico, filólogo	лингвистический, языковой, языковедческий	lingüístico, relativo al idioma	lingvistisk, språkforskar-	เกี่ยวกับภาษา เกี่ยวกับภาษาศาสตร์	dilbilimsel, dilbilim ile ilgili, dile ait
linguistics	n.	9629	11452	lɪŋgwˈɪstɪks	N/A	N/A	علم اللغة, علم اللغات, لسانية	语言学	Linguistik	γλωσσολογία	scientific study of language	linguistique; étude de la langue	linguistica (studio delle lingue)	言語学	언어학	linguïstiek	lingüística, ciência das línguas	лингвистика, языкознание	lingüística, estudio de las lenguas o idiomas	lingvistik, språkvetenskap	ภาษาศาสตร์	dilbilim
liter	n.		14476	lˈitɜ	liters	N/A	لتر وحدة قياس السوائل, لتر	公升	Liter	λίτρο, ολίγος	metric unit of capacity	litre (unité de mesure des liquides)	litro (unità di misura dei liquidi)	リットル	리터, 용량을 재는 단위	liter (eenheid van volume)	litro, unidade de medida de capacidade	литр	litro (unidad de volumen para líquidos)	liter (volymenhet för vätskor)	ลิตร (หน่วยวัดปริมาณ 1 ลิตรเท่ากับ 0.264 แกลลอน)	litre
liver	n.	5970	5361	lˈɪvɜ	livers	N/A	مقيم, فاضل, كبد, عائش	肝脏, 生活者, 居民	Leber (Anatomie); flottes Leben	συκώτι, ζων	glandular organ of vertebrate animals which secretes bile and purifies the venous blood; brown-red shade; one who is alive, one who lives; dweller	foie (organe); couleur brun-rougeâtre; habitant; résident	(Anat, Gastr) fegato; (pop) mal di fegato	肝臓; レバー; 生活者; 居住者	간; 검붉은 그림자; 살아있는 사람; 거주자	lever (orgaan); bruin-rode kleur; het wonen; het bewonen	fígado (o órgão); tonalidade castanha; vivo; morador	печень [анат.]	hígado, higadilla, higadillo	lunga (organet); brunröd färg; levande person; person som för ett högt liv	ผู้อยู่อาศัย	karaciğer, ciğer
locally	adv.	5028	6492	lˈoʊkəli	N/A	N/A	محليا, على نحو محلي	N/A	an einem bestimmten Ort, im Hinsicht auf einen bestimmten Ort	N/A	in a particular place, with regard to a certain location	localement, dans un place particulière	localmente, in un luogo o zona particolare	局地で, 局地的に	N/A	op bepaalde plaats, met betrekking tot een bepaalde plaats	localmente	N/A	N/A	N/A	เฉพาะแห่ง เฉพาะที่, เฉพาะส่วน, เกี่ยวกับสถานที่	lokal olarak, bölgesel olarak, mahalli olarak
locus	n.	16403	13799	lˈoʊkəs	loci	N/A	موضع, محل هندسي, مكان, نقطة	N/A	Ort, Platz	τόπος	place, location	lieu, emplacement, locus (génétique)	località, luogo, posto; (Biol) locus	位置; 軌跡	현장	plaats	local, lugar	местоположение, геометрическое место точек, траектория, положение гена в хромосоме, положение гена на генетической карте	lugar, emplazamiento	plats, ställe	สถานที่	yer, mahal, gezenek
logical	adj.	4086	5753	lˈɑdʒɪkəl	N/A	coherent sound plausible reasonable understandable consistent obvious sensible commonsensical reasonable rational commonsense valid	منطقي, منطقي التفكير, معقول	N/A	logisch; (Comput) scheinbar, sieht wirklich aus exestiert aber physisch nicht	λογικός	based on logic; reasonable; simulated, looks and acts like the real thing but is not genuine (Computers)	logique, plausible; logique, se comportant et ayant l'aspect d'une chose réelle mais n'ayant pas de réalité physique (informatique)	logico (anche in inform.); plausibile; (inform.) immaginario, logico, sembra che sia reale invece non lo è dal punto di vista fisico	論理的な, 合理的な; 当然の, 必然の; 論理学の; （コンピュータ）ロジカルな	논리학의, 논리학상의	logisch (ook in computers), aannemelijk; (in computers) logisch (zogenaamd), gedraagt zich alsof het bestaat maar in werkelijkheid bestaat het fysiek niet	sensato, lógico (também em informática); provável; (informática) virtual, parece e se comporta como se fosse verdadeiro mas não é verdadeiro em forma física	логический, логичный, последовательный	lógico, analítico, consecuente, racional; (inform.) organización lógica de los datos o sistemas, virtual	logisk; följdriktig; ser ut som och beter sig som originalet men som inte är genuint (data)	สอดคล้องกับหลักเหตุผล (ความคิด) สอดคล้องกับหลักตรรกวิทยา	mantıksal, mantıklı, makul, tutarlı
longitudinal	adj.	18077	14401	lˌɑndʒətˈudənəl	N/A	N/A	طولي, طولانيlon·gi·tu·di·nal / ‚lɑndʒɪ'tuːdɪnl /‚lɒndʒɪ'tjuːdɪnl	N/A	Längen; längsgerichtetlon·gi·tu·di·nal / ‚lɑ;ndʒ;ɪ;'tuː;dɪ;nl /‚lɒ;ndʒ;ɪ;'tjuː;dɪ;nl	γεωγραφικού μήκουςlon·gi·tu·di·nal / ‚lɑ;ndʒ;ɪ;'tuː;dɪ;nl /‚lɒ;ndʒ;ɪ;'tjuː;dɪ;nl	of or pertaining to longitude or length; running lengthwiselon·gi·tu·di·nal || ‚lɑndʒɪ'tuːdɪnl /‚lɒndʒɪ'tjuːdɪnl	longitudinal; dans le sens de la longueurlon·gi·tu·di·nal / ‚lɑ;ndʒ;ɪ;'tuː;dɪ;nl /‚lɒ;ndʒ;ɪ;'tjuː;dɪ;nl	longitudinale; messo per il lungolon·gi·tu·di·nal / ‚lɑ;ndʒ;ɪ;'tuː;dɪ;nl /‚lɒ;ndʒ;ɪ;'tjuː;dɪ;nl	経度の; 長さの; 縦のlon·gi·tu·di·nal / ‚lɑ;ndʒ;ɪ;'tuː;dɪ;nl /‚lɒ;ndʒ;ɪ;'tjuː;dɪ;nl	경도의, 경선의lon·gi·tu·di·nal / ‚lɑ;ndʒ;ɪ;'tuː;dɪ;nl /‚lɒ;ndʒ;ɪ;'tjuː;dɪ;nl	in de lengte, lengte-lon·gi·tu·di·nal / ‚lɑ;ndʒ;ɪ;'tuː;dɪ;nl /‚lɒ;ndʒ;ɪ;'tjuː;dɪ;nl	longitudinal, referente à longitude; relativo ao comprimentolon·gi·tu·di·nal / ‚lɑ;ndʒ;ɪ;'tuː;dɪ;nl /‚lɒ;ndʒ;ɪ;'tjuː;dɪ;nl	продольный, относящийся к длине, относящийся к долготеlon·gi·tu·di·nal / ‚lɑ;ndʒ;ɪ;'tuː;dɪ;nl /‚lɒ;ndʒ;ɪ;'tjuː;dɪ;nl	longitudinal, relativo a la longitudlon·gi·tu·di·nal / ‚lɑ;ndʒ;ɪ;'tuː;dɪ;nl /‚lɒ;ndʒ;ɪ;'tjuː;dɪ;nl	längd-, längsgående; longitud-lon·gi·tu·di·nal / ‚lɑ;ndʒ;ɪ;'tuː;dɪ;nl /‚lɒ;ndʒ;ɪ;'tjuː;dɪ;nl	ตามยาว	boylamsal, boylamasına, uzunlamasınalon·gi·tu·di·nal / ‚lɑ;ndʒ;ɪ;'tuː;dɪ;nl /‚lɒ;ndʒ;ɪ;'tjuː;dɪ;nl
loop	n.	9539	3535	lˈup	loops looped looping	disk circle round sphere ball ring	رباط ستارة, عقدة, أنشوطة, التحلق, الإ نقلاب ضرب من الطيور, دائرة كهربائية	环, 圈, 弯曲部分, 循环	Schleife, Schlaufe, Öse	θηλειά, βρόχος, κάνω θηλείαν, κουλούρα	rope (or cord, thread, etc.) which has curved and doubled over itself leaving a circular opening; something which has a curved or circular shape; intrauterine device shaped like a loop; type of stunt performed by an airplane	boucle; cravate; manoeuvre d'aviation (loopings); fissure; ouverture étroite	cappio, nodo scorsoio; laccio; curva, sinuosità; occhiello; ansa; occhiello metallico; passante; maglietta, asola a cordoncino; (Ferr) area di raccordo; (Aer) looping, gran volta, cerchio della morte	輪; 輪状のもの; 湾曲部	고리; 휘거나 둥근모양의 것; 루프모양으로 생긴 피임기구; 공중제비	lus, strop; knoop; spiraaltje; nauwe opening	laço, gravata; "grupo de oito", labirinto; racha, fenda, abertura estreita	петля, окружная дорога, обгонный путь, спираль, виток	lazo, aro, ojal	ögla, slinga; slingrande, krökande; spiral; smal öppning, spricka	ห่วงคุมกำเนิดที่ใส่เข้าไปในช่องคลอด	ilmik, ilmek, ilik, düğüm, dönme, döngü [bilg.], kavis, takla, spiral
