Word	POS	BNC Rank	Google Rank	IPA	Conjugations	Synonyms	Arabic	Chinese	German	Greek	English	French	Italian	Japanese	Korean	Dutch	Portuguese	Russian	Spanish	Swedish	Thai	Turkish
reactive	adj.	14898	13452	riˈæktɪv	N/A	hasty unthinking immediate imprudent rash	تفاعلي, رجعي, ارتكاسي, متفاعل, مفاعل	N/A	reaktiv	αντιδραστικός	responding to stimuli, acting in return	réactif, qui exerce une réaction	(Chim) reattivo, reagente	反動的な; 反作用的な; 反応の; 無効の	자극에 반응하는, 반작용하는	reagerend	reage	реагирующий, дающий реакцию, противодействующий, возвратный, реактивный	reactivo	reaktiv; återverkande	ซึ่งทำให้เกิดปฏิกิริยา	tepkili, tepki gösteren, duyarlı
reactor	n.	9983	12498	riˈæktɜ	reactors	N/A	مفاعل ذري, مفاعل نووي, الراكس, مفاعل, راد الفعل	反应者, 反应器, 反应堆, 电抗器	Reaktor; Umwandlungsanlage	αντιδραστήρ, αντιδραστήρας, πυρηνικός αντιδραστήρας, πυρηνικός αντιδραστήρ	person or thing which responds; vessel in which chemical reactions take place	réacteur; moteur, propulseur à réactions, récipient dans lequel est réalisée une réaction chimique	(Chim, El) reattore; (Atom) reattore nucleare, pila atomica	原子炉; 反応装置	반응을 나타내는 사람 또는 사물; 화학 반응이 일어나는 용기	kernreactor; reactievat, reactor	reator; pessoa que reage	дроссель, реактивная катушка, реактор, стабилизатор, атомный котел	reactor; reactivo	reaktor; reagens	เครื่องปฏิกรณ์นิวเคลียร์ ปฏิกรณ์, เครื่องปฏิกรณ์, เตาแยกปฏิกรณ์ปรมาณู	reaktör, tepki bobini
readily	adv.	3489	8171	rˈɛdəli	N/A	easily eagerly effortlessly speedily gamely voluntarily quickly willingly swiftly gladly unhesitatingly promptly cheerfully enthusiastically	حالا, بدون تردد, بسرور, عن طيب نفس, بسرعة, بسهولة, بيسر	N/A	bereitwillig	ετοίμως, πρόθυμα, προθυμώς	with pleasure, willingly, eagerly	avec plaisir; volontairement; avec vivacité	prontamente, volentieri e subito; facilmente, senza difficoltà	簡単に; 快く	쾌히, 기꺼이	gemakkelijk; gaarne	com prazer	с готовностью, легко, охотно, без труда, быстро	fácilmente, ágilmente, cómodamente, con facilidad, sin esfuerzo; de buena gana, voluntariamente	villigt	อย่างไม่ลังเล อย่างเต็มใจ, อย่างทันทีทันใด	kolayca, çabucak, isteyerek, seve seve, can atarak
realism	n.	8803	15673	rˈiəlɪzm	N/A	practicality pragmatism	الواقعية, مذهب الواقعية	写实主义, 现实, 实在论	Realismus; Wirklichkeitsnah	πραγματισμός, ρεαλισμός	interest in reality, concern for the real; tendency to portray things in a realistic manner	réalisme, pragmastisme; naturalisme	(Filos, Lett, Art) realismo	現実主義; 写実主義; 実在論	현실주의; 사실주의	realisme	realismo, concretização	реализм	realismo, positivismo, verismo	realism	ลัทธินิยมความจริง	gerçekçilik, realizm
realistic	adj.	4929	6774	rˌiəlˈɪstɪk	N/A	N/A	واقعي, حقيقي	N/A	realistisch (Realitätsbezogen, ernüchtert, praktisch; basiert aus Realitätssinn)	πραγματικός, ρεαλιστικός	based on reality; practical, pragmatic; pertaining to realism in philosophy or the arts	réaliste; pratique; pragmatique; naturaliste	realistico	現実主義の; 現実的な; 写実主義の; 写実的な	실제적인; 실용적인; 현실주의의	realistisch (reëel, pienter, praktisch; gebaseerd op de realiteit)	realístico (relativo à realidade; que caiu em si; prático; baseado em dados reais)	реалистический, реалистичный, трезвый, практический	realista	realistisk (verklighetsbetonad, verklighetstrogen, verklig; verklighetsskildring)	ซึ่งปฏิบัติได้จริง ซึ่งสมเหตุสมผล	gerçekçi, realist, gerçeğe uygun
realm	n.	7939	8787	rˈɛlm	realms	N/A	حقل, مملكة, عالم دنيا	王国, 领土, 领域	Reich; Bereich, Sphäre; Gebiet	βασίλειο, χώρα	kingdom; domain, sphere; region, area	royaume; monde; domaine; région, zone	regno, reame	領域; 王国; 国土	왕국; 분야, 영역; 지역, 권, 범위	koninkrijk; wereld; gebied	reino, reinado; mundo; área, esfera, domínio	королевство, государство, область, сфера	reino, área, dominio, esfera	rike; värld; ämne	อาณาจักร ราชอาณาจักร	krallık, ülke, diyar, alan, alem
receptor	n.	12712	6260	risˈɛptɜ	N/A	N/A	حاسة, جهاز الإستقبال	受体, 感觉器官	Rezeptor; Empfänger	αισθητήριο νεύρο, αισθητήριο όργανο	acceptor, receiver, one who takes in; (Anatomy) sensor which receives stimuli (in the nervous system)	récepteur	recettore (nel sistema nervoso)	受容器; 受容体; 受体	수용기, 감각기관, 받아들이는 사람	ontvanger; receptor (in zenuwstelsel)	recebe; receptor (no sistema nervoso)	рецептор, рецепторное нервное окончание	receptor	en som mottager; receptor (i nervsystemet)	ผู้รับ ตัวรับ	N/A
recipe	n.	6955	2952	rˈɛsəpi	recipes	N/A	وصفة طعام, صيغة لإعداد طبخة, وصفة طبية, طريقة إجراء	食谱, 处方, 秘诀	Rezept	συνταγή	any set of written instructions; written instructions for preparing food; prescription, written instructions for the use of a medication	recette; ordonnance	(Gastr) ricetta; rimedio	作り方; 秘訣	처방, 수법, 비결; 조리법; 처방	recept	receita médica; fórmula; receita culinária	рецепт, предписание, средство, способ	receta, fórmula	recept	ใบสั่งยาของแพทย์ ใบสั่งแพทย์, ใบสั่งยา	yemek tarifi, reçete, tarife
reconstruct	v.	21514	27162	rˌikənstrˈʌkt	reconstructs reconstructed reconstructing	reform rebuild recreate modernize redo renovate restructure	أعاد البناء من جديد, أعاد البناء, أعاد التشكيل	N/A	wieder aufbauen; rekonstruieren	επανακτίζω, ανοικοδομώ, ανασχηματίζω, ανασκευάζω	rebuild, construct again, recreate, make again	reconstruire; reconstituer	ricostruire	再建する; 再現する; 復元する	재건하다, 다시 만들다	wederopbouwen; rekonstrueren	reconstruir, reerguer; remontar	перестраивать, реконструировать, восстанавливать, воссоздавать, пересмотреть	reconstruir, reconstituir, reedificar, regenerar, rehabilitar	återuppbygga; rekonstruera	N/A	yeniden inşa etmek, yeniden kurmak, yeni baştan yapmak, bozup yapmak, imar etmek, kalkındırmak
regime	n.	2948	6065	rəʒˈim	regimes	N/A	النظام أو السلطة, نظام الحكم, حمية رجيم	政权, 当权期间, 政体, 社会制度, 体制, 情态	Regierung, Kontrolle	καθεστώς, σύστημα, διοίκηση, δίαιτα	mode of rule, system of government, form of government	régime	regime, sistema politico; sistema sociale; dieta	制度; 政体; 統治様式; 政権; 統治期間	정권, 정부제도, 관리체제, 사회제도	regime; authoriteit; regering	regime, governo	режим; строй; диета	régimen	regim, styrelse, regering	ระบอบการปกครอง	rejim, yönetim şekli, düzen, sistem, diyet
regression	n.	11219	8635	rəgrˈɛʃən	regressions	failure decay drop deterioration debility waning degeneration weakening	نكوص, تراجع, انحسار, تردي, رجعة, الحركة التراجعية	退步, 回归	Regression, Rückgang	οπισθοδρόμηση	act of moving backward; return to a previous state, retrogression	régression; baisse; rétrogradation	regresso, regressione	後戻り; 退行; 逆行	퇴행, 역행; 이전의 상태로 돌아감	achterwaartse beweging, terugkeer, teruggang; achteruitgang, regressie	regressão, regresso; retrocesso	возвращение в прежнее состояние, возвращение, регрессия, упадок духа, обратное движение	retroceso, involución, regresión, retrogradación	regression, tillbakagång	การเสื่อมถอย การถอยกลับ	geri çekilme, dönüş, gerileme
rehabilitation	n.	9274	4973	rˌihəbˌɪlətˈeɪʃən	N/A	remedy healing analysis treatment therapy cure psychotherapy physiotherapy psychoanalysis	إصلاح, إعادة الأهلية, رد الإعتبار, إعادة تأهيل	复原	Wiederherstellung, Rehabilitation; Läuterung	εξέμεση, αναμόρφωση, επανόρθωση	restoration to good health or condition; restoration of a person's good reputation	réhabilitation, réadaptation; rééducation; désintoxication; redressement; restauration, rénovation	riabilitazione; restauro; (Sociol) reinserimento nella società; risanamento	社会復帰; 更生; 修復; 復職; 機能回復訓練	건강의 회복; 명예회복	rehabilitatie; (het) zuiveren van naam; revalidatie	reabilitação; recuperação do conceito, recobramento do bom nome	реабилитация, восстановление в правах, восстановление, ремонт, реконструкция, восстановление здоровья	rehabilitación, readaptación, terapéutica, terapia	rehabilitering, återupprättelse; återställande	การทำให้กลับสู่สภาพเดิม การทำให้กลับมาดีเหมือนเดิม	rehabilitasyon, iyileştirme, eski haline döndürme, haklarını geri verme, iade etme
reinforce	v.	10897	15730	rˌiɪnfˈɔrs	reinforces reinforced reinforcing	boost underline support highlight emphasize fortify bolster strengthen underpin buttress	عزز, قوى, سلح, عضد, دعم, ثبت, تعزز	N/A	bekräftigen, verstärken	ενισχύω	strengthen, fortify, support; increase; provide a reward or punishment in order to encourage or discourage a particular response (Psychology)	renforcer, consolider; fortifier, armer	(Mil) rinforzare; rafforzare; avvalorare; (Edil) armare, rafforzare un edificio	補強する; 増強する; 援軍を送る; 強化する	보강하다, 증강하다, 강화하다; 늘이다, 증가 시키다; 특정한 반응을 강화 또는 약화 시키기 위해 상벌을 주다 ( 심리학)	versterken	reforçar, aumentar a força	усиливать, укреплять, подкреплять, армировать	reforzar, afianzar, consolidar, fortalecer, fortificar, reafianzar, recalcar, respaldar, robustecer	förstärka, underbygga	N/A	takviye etmek, sağlamlaştırmak, güçlendirmek, pekiştirmek
rejection	n.	6046	11259	rɪdʒˈɛkʃən	N/A	N/A	رفض, نبذ, شىء مرفوض, شىء منبوذ, الرفض	拒绝, 抛弃, 驳回, 被抛弃的东西, 呕出物	Ablehnung, Verwerfung; Verneinung	απόρριψη	refusal, denial, act of rejecting; state of being rejected; auto-immune response to a transplanted organ or body tissue	réjection; refus, rejet	rifiuto, ricusa; scarto, oggetto di scarto; (Med) rigetto	拒絶; 排除; 廃棄物	거절, 거부; 이식기관이나 조직의 거부 반응	uitstel; weigering; afwijzing, afkeuring	rejeição, negação; eliminado, desclassificado	отклонение, непринятие, отказ, самоотвод; отсортировка, браковка, признание негодным, извержение	rechazo, desestimación, rechazamiento, repudiación, repudio, repulsa, repulsión	förkastande, förkastelse; avslag	การปฏิเสธ การไม่ยอมรับ	red, ret, reddetme, çıkarma, ıskarta, defolu mal, dışkı, atık
reliability	n.	9802	4180	rilˌaɪəbˈɪləti	N/A	N/A	إمكانية الإشتغال, دقة, صلابة	信度, 可靠性	Zuverläßigkeit; Bonität	αξιοπιστία	credibility, dependability, trustworthiness	fiabilité, crédibilité	fidatezza, fiducia; attendibilità, credibilità; regolarità; (tecn) affidabilità	信用性; 確実性	신뢰할 수 있음, 믿을 수 있슴	betrouwbaarheid	confiança, segurança	надежность, достоверность, прочность	fiabilidad, confiabilidad; veracidad; seriedad, formalidad	pålitlighet	ความน่าเชื่อถือ ความน่าไว้วางใจ, ความไว้ใจได้	güvenilirlik, güvenlilik, emniyet, dayanıklılık
render	v.	12982	9758	rˈɛndɜ	renders rendered rendering	N/A	قدم مساعدة, سكب, ملط الطين, قدم الحساب, شكر, عزف, غنى, سلم, قدم خدمة, طلى, ذاب, سلم رسالة, رد, رجع, صير, دهن	N/A	leisten, abgeben, erweisen, wiedergeben, erstatten (Comput) malen, automatisch durch ein 3-D Modell das sich im Computer befindet ein Bild erzeugen	ανταποδίδω, προσφέρω, καθιστώ	give, submit; do; transform; bring to a particular condition; represent, depict; translate; automatically create a three-dimensional picture according to a model within a computer (Computers)	donner, rendre, transformer en, présenter; traduire; transmettre; dessiner, restituer une image en trois dimensions afin de lui donner une image plus réaliste (Informatique)	fare; trasformare; fare divenire; accedere, recare; (inform.) disegnare, produrre automaticamente un'immagine grazie al modello tridimesionale del computer	する; 与える, 尽くす, 行う; 報いる; 返す; （コンピュータ）レンダリングする, コンピュータにある3Dモデルを自動的に画像にする	되게 하다, 되게 만들다, 사람 등을 ...한 상태로 되게 하다, 사람 등을 ...한 상태로 되게 만들다, 봉사를 하다, 원조를 하다, 나타내다, 공경의 뜻 따위를 나타내다, 보답으로 주다, 치르다, 당연히 지불해야 할 것을 치르다, 포기하다, 내다, 계산서 따위를 내다, 이유 따위를 내다, 회답 따위를 내다, 표현하다, 번역하다, 정제하다, 지방을 녹여서 정제하다, 초벌칠을 하다, 애?*ECT*/	doen; veranderen; veroorzaken; presenteren; indienen, doorgeven (in computers) tekenen, beeldconverteren van driedimensionale tekeningen in foto-realistische beelden	fazer; inverter; servir, passar; (informática) desenhar, criar de forma automática uma imagem conforme o modelo tridimensional que se encontra no computador	воздавать, отдавать, платить; оказывать услугу, исполнять; изображать, воспроизводить; передавать, переводить; автоматически создавать трехмерное изображение (комп.)	dar, prestar, rendir, suministrar; poner; (inform.) dibujar, crear en forma automática una imagen de acuerdo al modelo tridimensional que existe en el ordenador	ge; erlägga, göra; tolka; automatiskt skapande av tredimensionella bilder enligt en modell inom datoren (data)	N/A	geri vermek, vermek, etmek, sunmak, açıklamak, kılmak, hale getirmek, çevirmek, çevirisini yapmak, yorumlamak, çalmak (müzik), eritmek (yağ), ilk kat sıva sürmek
repertoire	n.	12822	18176	rˈɛpɜtwˌɑr	repertoires	N/A	الذخيرة من احتياطي مسرحيات والحان وأدوار, ذخيرة مجموعة مسرحيات	全部剧目, 全部技能, 全部节目, 全部作品	Repertoire; Vorrat	δραματολόγιο, ρεπερτόριο	list of works that a person or group is ready to perform; collection of skills required for a particular profession; collection including all existing artistic works of a specific kind	répertoire, catalogue, index; agenda, carnet; inventaire méthodique où les matières sont classées dans un ordre; liste des pièces ou oeuvres qui forment le fonds d'un théâtre; ensemble des oeuvres d'un auteur ou artiste	(Teat) repertorio	レパートリー; 能力の範囲; たくわえ	레퍼토리, 개인이나 그룹이 상연을 위해 준비하는 작품의 목록; 특별한 전문 직업에 요구되는 기술의 모음; 예술작품을 포함한 특정종류의 모음	repertoire	repertório	репертуар	repertorio	repertoar, spellista	บทละครหรือบทเพลงซึ่งเป็นที่รู้จักดี	repertuar, oyun listesi
replacement	n.	3682	2563	rɪplˈeɪsmənt	replacements	substitution proxy alternate surrogate understudy substitute	بديل, تبديل, نيابة, شىء يحل محل آخر, إعادة شئ الي مكانه	归还, 更换, 代替者	Ersatz, Austausch	αναπλήρωση, αντικατάσταση	substitution, act of replacing one thing with another; person or thing that takes the place of another, substitute	remise en place; remplacement; substitution; pièce de rechange, remplaçant	sostituzione, rimpiazzo, ricambio; sostituto; pezzo di ricambio	取り替え; 交替; 代わりのもの; 代用品	대치, 교체; 대체, 교환	vervanging; surrogaat	troca, substituição, reposição	замещение, замена, заменитель; подмена, пополнение; пополнение в личном составе, возмещение войскам материальных средств	reposición, reemplazo, substituto, suplencia, suplente, sustitución	återinsättande, avlösning, ersättning	การทำหน้าที่แทน การทดแทน	yedek, değiştirme, yerine koyma, yerine geçen kimse, protez
replicate	v.	34248	20501	rˈɛplɪkˌeɪt	replicates replicated replicating	imitate photocopy repeat duplicate copy reproduce	طوى, ثنى, توالد, تكاثر	N/A	kopieren; nachbilden; replizieren	N/A	duplicate, copy, reproduce, make a facsimile	dupliquer, copier; reproduire	replicare	複写する; 繰り返す; 折り返す; 複製する	복사하다, 재생산하다, 복제하다	kopiëren; herhalen	fazer uma cópia, replicar	копировать, делать реплику, повторять	replicar, copiar, duplicar, reproducir; ser contradictorio	göra en exakt kopia	N/A	kopya etmek, aynını yapmak, tekrarlamak
replication	n.	19324	9815	rˌɛplɪkˈeɪʃən	N/A	imitation duplication reproduction copying	N/A	回答, 反响, 复制, 第二次答辩, 折转, 弯回	Kopie, Nachbildung, Replikation	N/A	duplication, act of copying, reproduction; answer, response, reply; echo, reverberation; process by which strands of DNA are copied; act of folding	réplique; copie, reproduction exacte; réponse, écho; réverbération	risposta, replica; (Acu) eco, riverbero; copia, riproduzione, duplicato	応答; 再抗弁書; 原告の第二の訴答; 折り返り; 繰返し; 複製	복사, 복제; 응답; 메아리, 반향; DNA복제의 진행; 접음	repliek;kopie, navolging, echo; celdeling	réplica , cópia; dobra; resposta	ответ, возражение, копирование, копия, репродукция	copia, réplica	kopia; vikning; svar	คำตอบ	cevap, yankı, eko, kopya, aynısı
reproduce	v.	14014	9892	rˌiprədˈus	reproduces reproduced reproducing	duplicate repeat imitate replicate breed produce copy procreate mimic	إستنسخ ثانية, أنتج ثانية, تكاثر, نسخ, إستنطق الاسطوانة, تناسل, توالد, انتشر, أنتج, حدث مرة ثانية	N/A	sich fortpflanzen, sich vermehren; reproduzieren	αναπαράγω	procreate, multiply, produce offspring; duplicate, copy; re-create, remake	se reproduire, se multiplier; reproduire, copier; dupliquer, recréer, refaire	riprodurre, rappresentare, ritrarre; produrre di nuovo; generare; rigenerare; riportare; ripetere	再生する; 再現する; 複製する; 繁殖する; 増やす	생식시키다, 번식시키다; 복사하다; 재생시키다	geboren worden, verwekken, voortbrengen; vermeerderen; reproduceren	reproduzir-se, multiplicar-se; reproduzir (um crime), remontar	производить, порождать, восстанавливать, воспроизводить, делать копию, размножаться	reproducirse, criar; copiar, duplicar, estereotipar, recrear, repetir	fortplanta, reproducera; återge	N/A	yeniden üretmek, yenisini yapmak, çoğaltmak, türetmek, kopyasını çıkarmak, reprodüksiyon yapmak, çoğalmak
reproduction	n.	7413	4954	rˌiprədˈʌkʃən	reproductions	N/A	إنجاب, نسخ, استنساخ, توالد, تكاثر, تناسل, إنتاج, صورة, تصوير, نقل, تقليد, نسخة طبق الأصل	再现, 复制, 生殖, 繁殖, 复制品	Fortpflanzung; Reproduktion; Wiedergabe	αναπαραγωγή, αντίγραφο, γένεση	procreation, act of producing offspring; duplication, act of copying; copy, duplicate; re-creation, act of remaking	reproduction, procréation; copie, imitation; duplicata	riproduzione	再生; 再生品; 再演; 複写; 模造品	생식, 번식; 복사; 재생	geboorte; reproduktie; kringloop, omloop	reprodução, multiplicação, o ato de reproduzir-se; cópia; reciclagem; ciclo	воспроизведение, размножение, копия, репродукция, восстановление, возобновление, воспроизводство	reproducción, apareamiento; copia, reprografía	fortplantning; reproduktion; återgivande	การแพร่พันธุ์ การสืบพันธุ์	yeniden yapma, türetme, üreme, çoğalma, tekrar oynama, reprodüksiyon, taklit, eserin kopyası, yeniden basma, kopan organın tekrar çıkması
republic	n.	3646	1500	ripˈʌblək	republics	state nation democracy	جمهورية, دولة جمهورية, رجال الأدب	共和国, 共和政体, 团体, 界	Republik (Staat mit republikanischer Regierungsform; demokratische Regierungsform, dessen Präsident von den Staatsbürgern gewählt wird)	δημοκρατία	form of government in which citizens hold the power to elect their representatives; nation in which citizens elect their representatives	république, forme de gouvernement où le pouvoir et la puissance ne sont vpas détenus par une seule personne; état gouverné par des représentants élus pour un temps limité	(Pol) repubblica	共和国; 共和政体; 社会	공화국; 공화제, 국민이 그들의 대표를 선택할 수 있는 권리를 가진 국가 형태	republiek (regeringsvorm waarbij leider democratisch gekozen is door het volk)	república (Estado cujo governo é feito através de uma república; tipo de regime democrático no qual os dirigentes do Estado são eleitos através do povo)	республика, группа людей с общими интересами	república	republik (stat med republik som statsform, en demokratisk statsform där statens medborgare röstar fram en president eller ett statsöverhuvud)	สาธารณรัฐ	cumhuriyet
resemble	v.	21059	19604	rɪzˈɛmbəl	N/A	N/A	شابه, شبه, ماثل, تشابه, تماثل	N/A	ähneln	ομοιάζω, μοιάζω	be similar to, be akin to; look like, have a similar appearance to	ressembler; être similaire, sembler comme, avoir la même apparence que	somigliare a, rassomigliare a	似る, 類似する	닮다, 유사하다; 비슷한 외관을 같다	lijken op	lembrar alguém, parecer-se a	походить на, иметь сходство, быть похожим	parecerse a, asemejarse, semejarse a	vara lik	N/A	benzemek
reservoir	n.	11218	9401	rˈɛzəvwˌɑr	reservoirs	pool lake tank basin	خزان, احتياطي, صهريج, فنطاس حوض, ذخيرة	贮水池, 贮藏处, 贮备, 水库	Reservoir; Vorratsbehälter; Speicher	δεξαμενή, ντεπόζιτο	large lake for storing water; container used to collect and store water; additional supply, reserve; area or location where something is stored (esp. liquid)	réservoir, citerne, cuve, château d'eau; réserve	(Idr) serbatoio, cisterna; bacino idrico, lago artificiale; (fig) scorta, riserva	貯水池; インク筒; 油つぼ	저수지; 저장소, 저수조; 저장, 비축; 저장소	vergaar-, waterbak, (water)reservoir; bassin, verzamelbekken	reservatório; depósito	бассейн, водоем, водохранилище, резервуар, баллон, сокровищница, хранилище, запас, источник, склад	alcubilla, depósito, estanque, silo, reserva; represa, embalse, presa de contención	reservoar; behållare	ที่เก็บสะสม	rezervuar, su deposu, depo, hazne
