Word	POS	BNC Rank	Google Rank	IPA	Conjugations	Synonyms	Arabic	Chinese	German	Greek	English	French	Italian	Japanese	Korean	Dutch	Portuguese	Russian	Spanish	Swedish	Thai	Turkish
abdominal	adj.	12978	13609	æbdˈɑmənəl	N/A	N/A	N/A	N/A	des Bauches, des Leibes	γαστρικός, κοιλιακός	of or pertaining to the abdomen, of the belly, of the stomach area	abdominal	addominale, degli addominali, dello stomaco	腹部に関係する, 腹部の, 胴体の	복부의	van de buik; tot de buik behorend	abdominal	брюшной, абдоминальный, брюхоперый	abdominal	buk-, mag-, abdominal	เกี่ยวกับท้อง ตรงช่องท้อง	karın ile ilgili
absorb	v.	11466	15815	əbzˈɔrb	absorbs absorbed absorbing	N/A	امتص, استوعب, تشرب, استغرق	N/A	aufsaugen; aufnehmen	αφομοιώνω, απορροφώ	suck up; take up, take in	absorber; amortir	assorbire; assimilare; (fig) assorbire l'attenzione di; occupare, impegnare	吸収する; 取り込む; 夢中にさせる; 奪う	흡수하다; 흡수 동화하다, 열중시키다	absorberen; opnemen	absorver, sugar; captar	всасывать, впитывать, поглощать, абсорбировать; захватывать; вбирать, впивать; включать; амортизировать	absorber, embeberse de, concentrar; amortiguar; ser absorbente; cautivar la atención de, absorber el interés	absorbera, suga upp; införliva	N/A	kavramak, anlamak; emmek, özümsemek, çekmek, yutmak; devralmak
absorption	n.	8476	9690	əbzˈɔrpʃən	absorptions	amalgamation incorporation assimilation combination inclusion fascination interest captivation engagement immersion concentration	امتصاص, استيعاب, تشريب, استغراق, انهماك, مص	吸收, 专心, 全神贯注	Absorption (Chem., Phys.); Aufsaugung, Aufnahme; Vertiefung	απορρόφηση, απορροφητικότητα	sucking up; taking in; preoccupation, mental engrossment	absorption; approfondissement; intégration	assorbimento, assimilazione; (fig) profondo interesse	吸収; 併合; 夢中になること, 専心すること	흡수; 병합; 몰두, 전념	absorptie; verdieping; het worden opgenomen	absorção; concentração; aprofundamento	всасывание, впитывание, поглощение, абсорбция; погруженность	absorción, abstracción, enfrascamiento, ensimismamiento, imbibición	absorption, uppsugning; försjunkenhet; införlivande	การหมกมุ่น	emme, içine çekme, emilme; kendini verme, dalma
accelerate	v.	17283	13323	æksˈɛlɜˌeɪt	accelerates accelerated accelerating	N/A	سرع, عجل, عاجل, تسارع	N/A	beschleunigen; Geschwindigkeit erhöhen	επιταχύνω	cause to move or happen faster, hasten; increase the speed of, quicken	accélérer; presser	accelerare	加速する; 促進する	속력을 빠르게 하다, 촉진하다; 시기를 빠르게 하다	versnellen; snelheid verhogen	acelerar; apressar	ускорять, разгонять, увеличивать скорость, ускоряться, ускорить	acelerar, apresurar la marcha, meter prisa; apresurar la marcha de	accelerera, öka hastigheten; påskynda	N/A	hızlanmak, hız kazanmak, hızlandırmak, çabuklaştırmak, gaza basmak; canlandırmak; özendirmek
acceleration	n.	10970	11390	ˌæksˌɛlɜˈeɪʃən	accelerations	hastening hurrying quickening rushing	تسارع, تعجيل, تسريع, عجلة	加速, 促进, 加速度	Beschleunigung	επιτάχυνση	increase of speed	accélération	accelerazione	加速	가속	versnelling	aceleração	ускорение, учащение, акселерация	aceleración, aceleramiento, aumento de velocidad; prisa	acceleration; påskyndande	ความเร่ง	süratlenme, hızlandırma, hızlanma, ivme
accent	n.	6191	8872	əksˈɛnt	accents accented accenting	N/A	لهجة, نبرة, العلامة النطقية, توكيد	重音, 口音, 特点, 注重点	Akzent; Betonung	τόνος, προφορά	mode of pronunciation characteristic of a group of people or region; emphasis placed on a certain syllable in a word; mark on a letter or word showing stress or pitch; emphasis; contrasting element	accent; mise en relief; accentuation	accento; accento straniero; tono, intonazione, cadenza; enfasi, rilievo, risalto; (mat.) apice;	なまり, 人々や地域による発音の特徴; 言葉の確実な音節を強調すること; アクセント符号をつけること; 強調すること; 構成要素を対比させること	사람이나 지역의 독특한 발음양식; 단어에서의 액센트; 강조	accent; aandacht; nadruk	acentuação, acento; sotaque; tom, inflexão da voz	ударение, знак ударения, произношение, акцент, отличительный признак, главная черта, речь, язык	acento, tilde; deje, dejo, modulación, pronunciación, tonillo, tono; énfasis, acentuación	accent (språkligt); tryck; betoning	สำเนียง	aksan, şive, vurgu, aksan işareti; ağız; ayırıcı özellik; önem
accumulate	v.	20404	19229	əkyˈumyəlˌeɪt	accumulates accumulated accumulating	N/A	كوم, تكدس, جمع, ركم, تراكم, كدس	N/A	speichern; aufheben; sammeln	συσσωρεύω, συσσωρεύομαι	amass, gather, collect; be gathered, be collected	accumuler; cumuler; s'accumuler, être accumulé	accumulare, ammucchiare, ammassare, mettere insieme	集める; 蓄積する	모으다; 모이다	opstapelen; ophopen	acumular; amontoar; aumentar, crescer	накапливать, накопить, скапливать, аккумулировать, складывать	acumular, acaudalar, acopiar, aglomerar, amasar, amontonar	ackumulera, samla; ackumuleras, samlas, hopas	N/A	toplamak, biriktirmek, yığmak, toplanmak; birikmek
accumulation	n.	8591	11474	əkyˌumyəlˈeɪʃən	N/A	buildup accretion accrual gathering growth addition increase amassing collection stock store hoard deposit heap	تراكم, تكديس, تجميع, شىء متراكم, تراكمي	积聚, 累积, 积聚物	Ansammlung; Anhäufung; Akkumulation; Haufen	συσσώρευση	gathering; collection; agglomeration, pile	accumulation; cumul	accumulazione; cumulo, mucchio; raccolta, collezione; (Econ) capitalizzazione	収集; 蓄積; 蓄積物	모으기; 축적,집적	stapel; hoop; accumulatie	acumulação; acúmulo; amontoamento	накопление, аккумуляция, собирание; груда, масса; скопление	acumulación, acumulamiento, agestión, aglomeración, agolpamiento, cúmulo, montón	hopande, samlande; anhopning, ackumulation	ของที่เก็บสะสม ของที่รวบรวมไว้	birikim, yığın, toplanma
accuracy	n.	5399	2700	ˈækyɜəsi	accuracies	correctness exactness precision truth truthfulness	دقة, صبغ, ضبط	精确, 正确	Genauigkeit, Präzision	ακρίβεια	preciseness, exactness	exactitude, ponctualité	precisione, esattezza; accuratezza, diligenza	正確さ	정확, 정확성	nauwkeurigheid; precisie	exatidão; precisão	точность, правильность; прецизионность, тщательность, аккуратность; меткость	exactitud, precisión, veracidad	exakthet, precision	ความระมัดระวัง ความสามารถที่จะหลีกเลี่ยงข้อผิดพลาด	doğruluk, kesinlik, tamlık; ayar
accurately	adv.	6097	8359	ˈækyɜətli	N/A	N/A	بدقة, على نحو صحيح, على نحو مضبوط	N/A	genau, präzise	N/A	precisely, exactly	exactement, fidèlement	esattamente, con precisione; accuratamente	正確に	정확히	precies, nauwkeurig	exatamente; primorosamente	точно, правильно, тщательно, безошибочно	exactamente, acertadamente, acuradamente, atinadamente, con precisión, concienzudamente, escrupulosamente, fielmente, religiosamente	exakt, precist	อย่างแม่นยำ อย่างถูกต้อง, อย่างเที่ยงตรง	tam olarak, kesin olarak
acid	n.	2113	2569	ˈæsəd	acids	N/A	N/A	酸, 酸类物质, 尖刻, 迷幻药	Säure, chemische Verbindung die zusammen mit Basen Salze bildend (Chemie); sauer schmeckende Substanz; Sarkasmus; LSD (Slang)	οξύς, οξύ, οξύ χημεία	any of a group of sour-tasting substances that dissolve in water and form salts when combined with bases (Chemistry); substance having a sour taste; acerbity, sarcasm; LSD (Slang)	acide, L.S.D.	(Chim) acido; (fig) acidità, mordacità; (sl) LSD	酸; 酸を含んだもの（化学）; 酸っぱいもの; 渋さ; LSD（俗語）	산 (화학); 신맛이 나는 것; 신랄함; 환각제 엘에스디(속어)	zuur; L.S.D.	ácido (Química); substância de gosto azedo ou amargo; sarcasmo; LSD (Gíria)	кислота; язвительность, ехидство; ЛСД	ácido	syra; LSD (narkotisk drog)	N/A	asit, lsd
acidic	adj.	25364	24019	əsˈɪdɪk	N/A	acid sharp tart sour bitter	محمض	N/A	säurehaltig; Säure erzeugend; sauer; säuerlich; bissig	N/A	resembling acid; acid forming; containing large amounts of silica	acide, acidifiant; âcre; aigre	(Geol) siliceo; acidogeno	酸のような; 酸性の; 大量のシリカを含む	산성의; 산을 형성하는	zuur; bits; bijtend; wrang	de ácido; azedo; acetoso	кислый	ácido, acedo, ácidico	syra-; sur; bitter; som innehåller syra; syrlig	ซึ่งเป็นกรด ที่มีคุณสมบัติเป็นกรด	N/A
activate	v.	22827	10048	ˈæktəvˌeɪt	activates activated activating	N/A	فعل, شغل, نشط, أعد, جهز, زود وحدة عسكرية	N/A	starten, aktivieren	θέτω εις ενέργειαν, δραστηριοποιώ	set in motion, make active, start; speed up a reaction (Chemistry); make radioactive (Physics)	activer	attivare, rendere attivo; (Fis, Chim) rendere radioattivo; (Mil) organizzare	活動させる; （化学）活性化する; 放射性にする（物理学）	활동적으로 하다, 활성화하다; 반응을 빨리 일으키게 하다(화학); 방사능을 부여하다, 방사성으로 하다(물리)	aanzetten tot handeling	ativar, acionar, fazer funcionar; acelerar uma reação (Química); tornar radioativo (Física)	активировать, активизировать, включать; делать радиоактивным; зачислять в часть, формировать и укомплектовывать	activar, accionar, meter acción a, mover, poner en marcha, en funcionamiento; desencadenar, provocar; excitarse	aktivera, göra verksam	N/A	etkinleştirmek, harekete geçirmek, aktif hale getirmek; kurmak (birlik)
actively	adv.	5880	7030	ˈæktɪvli	N/A	N/A	N/A	N/A	aktiv, tatkräftig	δραστήρια	in an active manner, energetically, vigorously, busily	activement; avec énergie, de manière active	attivamente	活発に, 積極的に	활발히，능동적이게	ondernemend; actief; bijdragend, op een ondernemende manier	ativamente, diligentemente; efetivamente; produtivamente	активно	activamente, enérgicamente	aktivt, verksamt; livligt	อย่างกระฉับกระเฉง อย่างแข็งขัน, อย่างขยันขันแข็ง, อย่างคล่องตัว, อย่างคล่องแคล่ว, อย่างกระตือรือร้น	N/A
acute	adj.	4123	5689	əkyˈut	acuter acutest	N/A	فطين, ذكي, عصيب, حاد, مبرح, شديد, خطير, فطن, ثاقب, قوي	N/A	akut	έντονος, οξύνους, οξύς	grave, serious, severe; keen, sharp, sensitive; penetrating, shrewd; less than 90 degrees (Geometry); pointed	grave; sérieux; vif; aigu	acuto, aguzzo, appuntito, acuminato; perspicace, sottile, penetrante; intenso, vivo; grave, critico	激しい; 急性の; 深刻な; 鋭角の, 90度以内の（幾何学）; 鋭い	심한, 격렬한, 심각한; 날카로운, 예리한, 예민한; 매서운, 통렬한 ; 급성의; 예각의(기하학); 끝이 뾰족한	ernstig; serieus; scherp; acuut	agudo; fino; sério	острый, резкий; проницательный, сообразительный; пронзительный, сильный, высокий; заостренный; угол менее 90 градусов (геом.)	agudo, afilado, incisivo; intenso, penetrante, punzante; perspicaz, ingenioso	akut; allvarlig; stark (smak); skarp, spetsig	แหลม ที่มีปลายแหลม	keskin, sivri, şiddetli, ; akut, aşırı; dar (açı), ilerlemiş
adaptation	n.	9713	9669	ˌædəptˈeɪʃən	adaptations	N/A	تأقلم, تكيف, تهيئ, شىء مكيف أو معدل, كتاب معدل	适应, 改编, 改编本	Fassung; Anpassung	προσαρμογή	act of adapting; process of making one thing fit another; modification, adjustment	adaptation, modification changement; remaniement	adattamento; acclimatazione; modificazione; riduzione; accomodazione	適合; 適応させること; 修正	적응; 적응화; 개정, 적합화	bewerking; aanpassing	adaptação; acomodação	адаптация, приспособление, привыкание; применение; обработка, переделка, аранжировка	adaptación, aclimatación, acomodación, acomodamiento, acomodo, amoldamiento, familiarización	anpassning, adaption; bearbetning	การปรับตัว	adaptasyon, alıntı, uyma, aktarma, uyarlama, uygunluk, intibak
adaptive	adj.	18185	9230	ədˈæptɪv	N/A	N/A	N/A	N/A	anpassend, anpassungsfähig	N/A	capable of adapting; versatile	adaptatif (Biologie); versatile, multilatéral	adattabile, che può adattarsi; che si adatta; (Biol, tecn) adattivo, adattativo	適応できる; 環境順応を助ける; 適応させる	적응성이 있는, 적응할 수 있는; 융통성이 있는	zich aanpassend	adaptável; capaz de se adaptar	N/A	acomodable, adaptable	som anpassar sig; passande, lämplig	ซึ่งปรับตัวได้	uyabilen
adjacent	adj.	7592	6246	ədʒˈeɪsənt	adjacents	N/A	قريب, متاخم, متجاور	N/A	neben; nahe; eng bei	γειτονικός, παρακείμενος, προσκείμενος, συνεχόμενος	near; next; adjoining	adjacent, contigu, attenant, avoisinant, limitrophe	adiacente, contiguo, attiguo, limitrofo	近くの; 近接した	근처의; 이웃의; 인접한	nabij, naast; dichtbij; aangrenzend; steunend	adjacente, contíguo; próximo; apegado	смежный, примыкающий, соседний	adyacente, adjunto, aledaño, circunvecino, contiguo, lindante, paredaño, yuxtapuesto	avgränsande, närliggande; grann-	ติดกัน ประชิดกัน, ประกบ, ข้างเคียง, ข้างๆ	bitişik; yakın, komşu
admission	n.	4431	4271	ædmˈɪʃən	admissions	N/A	سماح بالدخول, تسليم بقضية, اعتراف, إدخال, حق الدخول أو الإذن به, رسم الدخول, قبول	准许进入, 入场费, 录用, 承认	Eintritt; Eintrittserlaubnis; Geständnis	παραδοχή, αποδοχή, εισδοχή, είσοδος	entrance; permission to enter; confession	admission; entrée; aveu	ammissione, accesso, ingresso; permesso di entrare; entrata, prezzo d'ingresso, biglietto d'ingresso; confessione; riconoscimento	入ることの許可; 入場; 入場料; 自認; 入会; 入学	입장; 들어감을 허락함; 자백	toegang; toelating; erkenning	admissão; entrada; confissão	доступ, вход; входная плата; признание; принятие, допущение; новый пациент	admisión, acceso, entrada, recepción; confesión	tillträde; inträde; intagning	สิทธิ์ในการเข้าไป	giriş, girme, katılma, giriş izni, kabul, itiraf, giriş ücreti, emme [müh.]
adolescent	adj.	22335	9385	ˌædəlˈɛsənt	adolescents	teenager youth youngster juvenile minor pubescent teenage young youthful juvenile teen pubescent pubertal	مراهق, يافع	N/A	heranwachsend, in der Pubertät	N/A	of puberty, pertaining to the age between childhood and adulthood	adolescent	adolescente; da adolescente	青春期の; 未熟な; 思春期特有の	청년기의, 한창 젊은	opgroeiend	jovem; adolescente	юношеский, юный, подростковый	adolescente, púber; inmaduro, pueril	ungdomlig, ungdoms-, tonårs-	N/A	genç
adverse	adj.	7058	5679	ædvˈɜs	N/A	N/A	معاكس, مناوئ, عكسي, متعسر, وخيم, مائج, متجه نحو الجذع	N/A	ablehnend; widrig; dagegen	δυσμενής, ενάντιος, αντίθετος	hostile; contrary; opposed	adverse; hostile	avverso, ostile, contrario; sfavorevole	不利な; 逆の; 反対する	적의를 품은; 역의; 반대의	ongunstig; nadelig; tegenstrijdig	contrário; adverso; oposto	враждебный, неблагоприятный, вредный; противоположный, лежащий напротив, расположенный напротив	adverso; contrario, desfavorable; enemigo, negativo, perjudicial	fientlig; ogynnsam; motsatt; mot-	ตรงกันข้าม ตรงข้าม	ters, aksi, zıt, karşıt, aleyhte
aerosol	n.	33313	17013	ˈɛrəsˌɑl	N/A	spray vaporizer	الهباء الجوي	烟, 雾	Aerosol; Spraydose	αεροζόλ	liquid substance stored under pressure and released as a fine spray; container in which this is stored; tiny particle suspended in the atmosphere and carried by the wind (Ecology)	aérosol; vaporisateur; suspension de particules très fines solides ou liquides dans un gaz (écologie)	aerosol, spruzzatore; sospensione di particelle solide o liquide in un gas, usata come farmaco, insetticida e sim.; pulviscolo atmosferico trasportato dal vento (ecologia)	噴霧器; アトマイザー; （生態学）空中に漂い風によって運ばれる小さな粒子	압력으로 눌려 저장되어 스프레이 형태로 뿜어지는 액체입자; 에로졸이 저장된 용기; 공기상에 떠다니다 바람에 의해 이동되는 아주 작은 입자(환경학)	spray, spuitbus, aërosol; (ecologie) klein deeltje in de lucht voortbewogen door de wind	aerossol, substância coloidal armazenada sob pressão que após a sua liberação assume o estado líquido ou sólido; o recipiente em que a substância é armazenada; partícula suspensa no ar (Ecologia)	аэрозоль, аэрозольная упаковка, баллончик, мельчайшие жидкие частицы, мельчайшие твердые частицы	aerosol, rociador, atomizador; (ecología) partícula chica que es transportada en el aire por el viento	aerosol, spray, sprayflaska	ละอองของเหลว	aerosol
aesthetic	adv.	8454	13578	ɛsθˈɛtɪk	N/A	N/A	N/A	N/A	N/A	N/A	N/A	N/A	N/A	N/A	N/A	N/A	N/A	N/A	N/A	N/A	N/A	N/A
affirm	v.	33312	19473	əfˈɜm	affirms affirmed affirming	assert insist confirm avow state announce establish verify pronounce acknowledge support uphold encourage sustain	أكد, ثبت, قرر, أيد, علم مؤكدا, جزم	N/A	bestätigen; behaupten; verkünden	δηλώνω υπεύθυνα [νομ.], βεβαιώνω	confirm; claim; state to be true	affirmer, soutenir; confirmer, homologuer	affermare, asserire, dichiarare; confermare; (Dir) dichiarare solennemente	断言する; …と主張する; 誓う	단언하다, 확언하다; 확신을 갖고 주장하다; 사실임을 진술하다	bevestigen, bekrachtigen; toegeven	afirmar, aceitar, confirmar; opinar; declarar	подтверждать, утверждать, торжественно заявлять, скреплять подписью	afirmar, alegar, asegurar, aseverar, declarar formalmente; ratificar, confirmar	försäkra; intyga; bestämt påstå	N/A	söylemek, ileri sürmek, iddia etmek, beyan etmek, bildirmek, doğrulamak, onaylamak
afterward	adv.	80417	20128	ˈæftɜwɜd	N/A	later subsequently then next	N/A	N/A	nachdem, später	N/A	subsequently	après cela, ensuite	dopo, poi, successivamente, in seguito	後で, その後に	그후	later; nadien, naderhand	subseqüentemente, depois, mais tarde	затем, впоследствии, потом, позже	luego, después, más adelante, más tarde	efteråt, sedan	ภายหลัง หลังจากนั้น, จากนั้น, ทีหลัง, คราวหลัง, ตอนหลัง, ต่อมา, ต่อจากนั้น, คราวหน้า, ครั้งต่อไป, ต่อไป	sonra, sonradan, daha sonra
aggregate	adj.	8788	7023	ˈægrəgət	aggregates aggregated aggregating	collective total combined cumulative amassed summative comprehensive total collection mass whole combination combine amass collect accumulate total	إجمالي, على وجه الإجمال, كلي	N/A	zusammengefügt, gesamt	συνολικός	collective, total, taking all units as a whole	global, agrégé	globale, complessivo, totale; (Bot, Geol, Econ) aggregato	集合の; 総計の	집합적인, 총계의	totaal, aggregaat	agregado, incluido	совокупный, собранный вместе, весь, общий, сгруппированный, сложный, агрегатный	agregado; juntado	sammanlagd, total	N/A	toplanmış, biriktirilmiş, bütün, toplam
agriculture	n.	2653	2729	ˈægrɪkˌʌltʃɜ	agricultures	farming cultivation gardening	زراعة	农业	Landwirtschaft	γεωργία, γεωπονία	raising of crops and livestock	agriculture	agraria; agricoltura	農業; 農学	농업, 농학	landbouw	agricultura	агрокультура, сельское хозяйство, земледелие, агрономия	agricultura, agro, agronomía	jordbruk, agrikultur	เกษตรกรรม การเกษตร, กสิกรรม	tarım, ziraat, çiftçilik
airplane	n.	49139	9776	ˈɛrplˌeɪn	airplanes	aircraft plane jet airliner	طائرة	飞机	Flugzeug	αεροπλάνο	aeroplane, jet plane	avion	aeroplano, aereo, apparecchio	飛行機	비행기	vliegtuig	avião, jato	самолет, аэроплан	avión, aeronave, aeroplano	flygplan	เครื่องบิน	uçak
algebra	n.	26926	8150	ˈældʒəbrə	N/A	N/A	علم الجبر	代数学	Algebra	άλγεβρα	mathematical system that uses equations containing letters and numbers	algèbre, système mathématique qui utilise des équations combinant lettres et chiffres; calcul des grandeurs considérées d'une manière générale et représentées par des lettres	algebra	代数	대수학, 숫자와 문자를 포함한 방정식을 이용하는 수학 체계	algebra	álgebra	алгебра	álgebra	algebra	พีชคณิต	cebir
algorithm	n.	12564	4248	ˈælgɜˌɪðəm	N/A	N/A	نظام الحلول الحسابية, الحلول الحسابية	算法	Algorithmus; (Comput) Prozedur die zu einer wirksamen Problemlösung dient	αλγόριθμος	(Mathematics) step-by-step procedure used to solve a problem (often includes repetition of steps); step-by-step problem-solving procedure used within software applications (Computers)	algorithme, mode de calcul; suite d'opérations servant à résoudre efficacement des problèmes (informatique)	algoritmo, metodo di calcolo; (inform.) processo usato nella soluzione efficiente di un problema	（数学）算法, アルゴリズム ; （ コンピューター）算法, アルゴリズム	연산, 연산 방식	algorithme; manier van berekenen; een aantal nauwkeurig omschreven regels voor het oplossen van een probleem op een efficiente manier (in computers)	(Matemática) algoritmo, método de cálculo; método usado para a solução eficaz de um problema (Informática)	алгоритм (комп.), метод, правило	algoritmo, fórmula o serie de pasos para resolver un problema particular; serie de reglas claras y precisas para lograr una solución efectiva a un problema (ordenadores)	(Matematik) algoritm, särskilt utsatta regler och steg-för-steg beskrivningar för uträkningar (inkluderar ofta repetetiva steg); steg-för-steg lösningar som används inom olika applikationer (data)	ลำดับขั้นตอนที่แน่นอนซึ่งใช้ในการแก้ปัญหา	arap rakamları sistemi
alien	n.	10924	5965	ˈeɪliən	aliens	N/A	غريب, أجنبي, أبعد	外国人, 外侨	Ausländer; Ausserirdischer	αλλοδαπός	foreigner, person living in a nation where he or she is not a citizen; stranger, outsider; extra-terrestrial, creature from outer space	étranger, personne vivant dans une terre qui n'est pas son pays d'origine; extra - terrestre	straniero; forestiero; emarginato; extraterrestre, alieno	外国人; 見知らぬ人, 部外者; 余分の 物, 地球外生物	이방인，외국인，외계인	vreemdeling, buitenlander; vreemde; buitenaards wezen, marsmannetje, wezen van andere planeet	estrangeiro, estranho, forasteiro; extra-terrestre, alienígena	чужестранец, иноземец, иностранец, подданный другого государства; чужак; инопланетянин	extranjero, forastero, meteco, persona que vive en un país que no es su patria natal; especie viviente que viene del espacio exterior, criatura que viene de otro planeta	främling; utlänning	N/A	yabancı, yabancı uyruklu kimse, ecnebi; yaratık; haklardan mahrum bırakılan kimse; yabancı kelime, aktarma [dilb.]
