Word	POS	BNC Rank	Google Rank	IPA	Conjugations	Synonyms	Arabic	Chinese	German	Greek	English	French	Italian	Japanese	Korean	Dutch	Portuguese	Russian	Spanish	Swedish	Thai	Turkish
decay	v.	10352	10133	dɪkˈeɪ	decays decayed decaying	N/A	تفسخ, ذوى, فسد, انحط, اضمحل, تفتت, فساد, أضعف, وهن, رم	N/A	verfallen, verfaulen, verrotten	φθίνω	rot, decompose; deteriorate, waste away	faire pourrir; dégénérer	decomporsi, marcire, guastarsi, imputridire; (fig) deperire, indebolirsi; decadere, deteriorarsi, declinare; (fig) andare in rovina; (Fis) disintegrarsi; (Dent) cariarsi	腐る; 虫歯にする; 朽ちる; 衰える	부식하다, 부패하다; 퇴화하다, 시들어 떨어지다	vervallen, rotten	decair; sacrificar	гнить, разлагаться, ветшать, истлевать, портиться	corromperse, cariarse, descomponerse, encarroñarse, malearse, pudrirse; decaer, caer en decadencia, declinar, menguar, perecer, venir a menos; ser decadente	ruttna, förmultna; förfalla	N/A	çürütmek, çürümek, bozmak, bozulmak; zayıflamak, halsiz düşmek; parçalanmak, dağılmak; azalmak
deceive	v.	23741	30328	dɪsˈiv	deceives deceived deceiving	hoodwink mislead cheat con defraud betray swindle delude dupe trick misinform	ضلل, خدع, غش, كذب, خاتل	N/A	betrügen, täuschen	απατώ, ξεγελώ, εξαπατώ	cheat, mislead	tromper, abuser; décevoir	ingannare, raggirare, truffare; deludere la fiducia di	騙す; うそをつく	속이다, 사기치다, 기만하다	oplichten, misleiden	enganar, ludibriar	обманывать, обмануть; вводить в заблуждение, сбивать с толку; изменять, нарушать верность	engañar, defraudar, embaucar, embelecar, engatusar, mistificar, mixtificar, poner cuernos a, timar; tomar el pelo, birlar; ser engañoso, proceder con engaño, trapacear	bedra, vilseleda	N/A	kandırmak, kazık atmak, keklemek, dolandırmak, oyun etmek, ihanet etmek, yutturmak, aldatmak; kafeslemek, kafese koymak; faka bastırmak; yitirmek, kaybetmek; çarpmak
defect	n.	11511	10326	dˈifɛkt	defects defected defecting	N/A	خلل, ضعف, شائبة, علة عيب, مأخذ	缺点	Mangel, Nachteil, Defekt	ελάττωμα, ατέλεια, έλλειψη	imperfection; deficiency	défaut, imperfection, tare, défectuosité	difetto, imperfezione; mancanza, deficienza	欠点; 不足	결점; 결함, 결손	gebrek, mankement	defeito, falha	дефект, недостаток; порок, изъян; неисправность, повреждение; нехватка, недочет	defecto, defectuosidad	defekt, ofullkomlighet, fel	N/A	eksiklik, kusur, noksan; özür, sakatlık; bozukluk, arıza
deficiency	n.	10945	10764	dɪfˈɪʃənsi	deficiencies	N/A	حاجة, عجز, علة عيب, مقدار النقص, خلل, نقص	缺乏, 不足	Knappheit; Mangel	έλλειψη, ατέλεια, έλλειμμα, ελάττωμα	lack, shortage; defect	manque; insuffisance, carence, déficit	deficienza; difetto, insufficienza, mancanza; differenza; (Econ) disavanzo, scoperto, deficit; () carenza	不足; 不足量; 欠陥; 欠乏	부족함, 결핍; 결함	gebrek; gemis	deficiência, falta	отсутствие чего-л., нехватка, недостаток, неполноценность	déficit, deficiencia, falta, insuficiencia; defecto, imperfección, ineficiencia	ofullkomlighet; brist	ความขาดแคลน	eksiklik, eksik, yetersizlik; yoksunluk; gereksinim; kusur, noksan, açık, gerilik; hesap açığı
definite	adj.	5585	12247	dˈɛfənət	N/A	assured exact specific sure distinct noteworthy settled positive significant recognized unquestionable fixed stated explicit obvious important certain known convinced unambiguous positive	مؤكد, محدد, واضح, لا لبس منه, قاطع, معين, حاسم	N/A	definiert, entschlossen, klar; entschieden	οριστικός, ξεκάθαρος, σαφής, καθορισμένος	clear, decisive; limited; specific	défini, déterminé, catégorique, précis, clair	preciso, esatto, definito; fissato, determinato; sicuro, certo	限定された; 明確な; 特定の	명확한, 결정적인; 한정된; 일정한	bepaald, absoluut, duidelijk; beslissend, verzekerd	definido, claro; absoluto; limitado; específico	ясный, точный, определенный	definitivo, certero, cierto, claro, concreto, exacto, fuera de toda duda, positivo; categórico, concluyente; definido, bien definido, demarcado, determinado	avgränsad, fastställd, avgjord; absolut, otvetydig	แน่นอน แน่ชัด, แจ่มแจ้ง, ชัดเจน	kesin, şüphesiz, kuşkusuz; belirli, açık; kati; su götürmez
deflection	n.	34752	30052	dɪflˈɛkʃən	deflections	N/A	انعطاف, انحراف, إزاغة, الانعطاف	歪斜, 偏, 偏向	Ablenkung, Abweichung	εκτροπή, απόκλιση, παρέκκλιση	deviation, diversion, turning aside	déviation	deviazione; deformazione, incurvatura; (Rad, TV, Fis) deflessione	それること; 振れ; 偏向	빗나감, 비뚤어짐	afbuiging, afwijking, deviatie	desvio, deflexão	отклонение, девиация, отклонение стрелки; поправка, упреждение, прогиб, провес	desvío, desviación	avvikelse, böjning	ระยะที่เบี่ยงเบน ความมากน้อยของการเบี่ยงเบน	sapma, dönme
degrade	v.	55287	28859	dɪgrˈeɪd	degrades degraded degrading	N/A	لوث, نزل رتبة, أخزى, حط من قدر, جرده من, أهان, حت, انحط	N/A	erniedrigen, degradieren	υποβιβάζω, εξευτελίζω	humiliate, dishonor; reduce (in size, amount, etc.); break down (Chemistry)	dégrader, avilir	degradare, disonorare, rendere spregevole; umiliare	恥をかかせる; 減らす（量や大きさを）; 減成する（化学）	지위를 낮추다, 가치를 떨어뜨리다, 퇴화시키다; 저하시키다 ( 크기나 양에서); 유기 화합물을 감성하다( 화학)	kleineren, vernederen	degradar, desprezar, humilhar; reduzir; decompor	деградировать, разрушать, приходить в упадок, вырождаться; понижать, снижать, уменьшать; разжаловать, унижать, низводить на низшую ступень; ослаблять интенсивность тона, размывать	degradar, abellacar, aplebeyar, postrar; degenerarse, degradarse; perder calidad; bajar de puesto, ser degradante	förnedra, förödmjuka	N/A	indirmek, indirgemek, düşmek; rütbesini indirmek; küçük düşürmek, onurunu kırmak; rengini açmak, aşınmaya uğramak, gerilemek
deliberately	adv.	3506	14210	dɪlˈɪbɜətli	N/A	cautiously knowingly thoughtfully methodically intentionally slowly purposely ponderously consciously warily carefully	بترو, بتعمد, بتأن	N/A	mit Absicht	επίτηδες	intentionally, purposefully; methodically, in an unhurried manner	de propos délibéré, à dessein; avec intention, exprès	deliberatamente, volutamente; ponderatamente, cautamente; lentamente, senza fretta	故意に; よく考えて; ゆっくりと	신중히, 의도적으로; 신중하게, 천천히, 서둘지 않고	met opzet	propositalmente, deliberadamente	умышленно, не спеша, нарочно, обдуманно, осторожно, осмотрительно, медленно	deliberadamente, a propósito, a sabiendas, acordadamente, adrede, aposta, apostas, con deliberación, con intención, con premeditación, de propósito, intencionadamente, intencionalmente	avsiktligt	อย่างรอบคอบ อย่างสุขุม	kasten, kasıtlı olarak, tasarlayarak
delta	n.	20922	2822	dˈɛltə	N/A	N/A	دلتا الحرف الرابع اليوناني من الأبجدية, مثلث كحرف الدال اليوناني	三角洲, 希腊字母的第四个字	Delta (einer Flußmündung); 4. Buchstabe im griechischen Alphabet; Summe (Mathematik)	δέλτα	4th letter of the Greek alphabet; triangular section of land at the mouth of a river	delta (la quatrième lettre de l'alphabet grec; dépôt d'alluvions à l'embouchure d'un fleuve)	delta (quarta lettera nell'alfabeto greco; deposito di alluvio allo sbocco di fiume)	デルタ, ギリシアアルファベットの4番目の文字; 三角州	델타, 그리스 문자중 네번째 문자; 강어귀의 삼각형 모양의 지역, 삼각주	delta (4de letter in het Griekse alfabet; droog land aan voet van rivier)	delta (a quarta letra no alfabeto grego; terra firme no contorno de um rio)	дельта, треугольник [эл.]	delta, desembocadura	delta (den fjärde bokstaven i det grekiska alfabetet; torrt landområde vid flodmynning)	อักษรกรีกตัวที่ 4 (ตัวอักษรย่อคือ d)	delta, üç köşe; çatalağız
demonstrator	n.	45133	46045	dˈɛmənstrˌeɪtɜ	N/A	supporter marcher trainer activist tutor presenter campaigner teacher protester lobbyist instructor	متظاهر, مساعد مدرس, موظف في شركة لجذب المشتري	论证者, 证明者, 指示者, 示威者	Demonstrant; Vorführer	επιδεικνύων, αποδεικνύων, διαδηλωτής	one who demonstrates; one who participates in a public demonstration; one who uses a demonstration to teach or explain	manifestant; démonstrateur	dimostrante, manifestante; dimostratore; (Scol) insegnante che usa il metodo dimostrativo; assistente	証明する人; 実証する人; 実演する人; デモ参加者	보여주는 사람; 시위에 참가한 사람; 설명 또는 가르치기 위해 견본을 이용하는 사람	iemand die demonstreert; iemand die iets voordoet	manifestante; demonstrador	демонстрант, лаборант, ассистент профессора, демонстратор, участник демонстрации	demostrador, manifestador, manifestante	demonstrant; demonstratör (uppvisare)	ผู้สาธิต คนสาธิต	ispat eden şey; gösteren kimse, sergilenen şey, gösterici; asistan
denominator	n.	25876	24270	dɪnˈɑmənˌeɪtɜ	N/A	N/A	المقام في الحساب, صفة مشتركة, قاسم	分母, 命名者	Nenner	παρονομαστής	number below the line in a fraction (Mathematics); shared characteristic	dénominateur d'une fraction	(Mat) denominatore; (fig) denominatore comune	分母（数学）; 特質を分けること	분모 (수학); 공통의 특징	gelijknamige breuk	denominador, a parte inferior de uma fração, número pelo qual um valor é dividido	знаменатель, делитель	denominador	nämnare	ตัวหาร จำนวนส่วนในเลขเศษส่วน	payda, bölen
denote	v.	27299	12882	dɪnˈoʊt	denotes denoted denoting	N/A	دل, أشار, أعلن, رمز, ظهر, عنى	N/A	kennzeichnen, markieren	σημαίνω, δηλώ, δηλώνω, δείχνω, εμφαίνω	symbolize; mark	dénoter, montrer, indiquer; signifier; symboliser	denotare, indicare; stare per, rappresentare; segnare, contrassegnare; significare, voler dire	示す; 意味する	표시하다; 상징하다	aanduiden, aangeven	denotar, marcar, estipular	указывать, указывать на, показывать, отмечать, выражать, обозначать, значить, означать	indicar, dar a entender, denominar, denotar, designar, significar	beteckna, utmärka	N/A	göstermek, belirtmek, ifade etmek, işareti olmak, adı olmak
dense	adj.	8446	9769	dˈɛns	denser densest	N/A	كثيف, أبله, شديد, مغفل, كث, غبي	N/A	dicht; dumm	πυκνός, κουτός	compact, close; (Slang) stupid, slow	dense, épais, compact; stupide, lent	denso, fitto, folto, spesso; (fig) ottuso, sciocco, stupido; (Ott) scuro, opaco	密集した; 濃い; 頭の悪い	밀집한, 촘촘한; 우둔한, 둔한, 이해가 느린	dicht op elkaar; stom, idioot	denso, repleto, condensado; estúpido	густой, плотный; дремучий, непрозрачный; частый; компактный; тупой, глупый, недогадливый	denso, compacto; espeso, torpe, entontecido, estulto, estúpido	tät; dum	หนาแน่น ซึ่งอัดแน่น, แน่น, แออัด	sıkışık, yoğun; kalın; koyu; sık; kalın kafalı; negatifi şeffaf olmayan [fot.]
dependence	n.	6747	9158	dɪpˈɛndəns	N/A	N/A	اعتماد, اتكال, تبعية	依赖, 依存, 信赖	Abhängigkeit; Vertrauen	εξάρτηση, εμπιστοσύνη	reliance; trust	dépendance; confiance	il dipendere, dipendenza; fiducia, affidamento; relazione; subordinazione; (Med) assuefazione	頼ること, 依存; 従属; 信頼	의뢰, 의존; 신뢰	afhankelijkheid; vertrouwen	dependência; confiança	зависимость, подчинение, доверие, нахождение на рассмотрении, ожидание решения, подчиненное положение	dependencia, adicción	beroende; tillit	การพึ่งพาอาศัย การไว้เนื้อเชื่อใจ	bağımlılık, bağlı olma, güven, itimat; başkasının sırtından yaşama
depict	v.	33447	20731	dɪpˈɪkt	depicts depicted depicting	show describe illustrate represent portray	وصف, صور, رسم, مثل	N/A	schildern; darstellen	ζωγραφίζω, περιγράφω, απεικονίζω, παριστάνω	portray, characterize, draw, describe	décrire, dépeindre	dipingere; presentare, descrivere	描く; 描写する	묘사하다, 서술하다, 그리다	(af)schilderen, afbeelden	descrever; pintar	рисовать, изображать, обрисовывать, описывать	bosquejar, delinear, describir, figurar, pintar, representar, reseñar, retratar, trazar un esbozo de	avbilda, skildra, beskriva	N/A	çizmek, resmetmek; betimlemek; göstermek; tasvir etmek
derivative	adj.	28162	10441	dɜˈɪvətɪv	derivatives	N/A	مشتق, ثانوي, مشتقة اللفظ	N/A	abgeleitet	N/A	obtained from another source, derived, borrowed	dérivé, induit	(Ling) derivativo, derivato	派生した; 独創性のない	유래된, 파생된	afgeleid, niet oorspronkelijk	derivativo, derivado	производный	derivado, derivativo	härledd	N/A	türetilmiş, ikincil
descendent	adj.	160073	70431	dɪsˈɛndənt	N/A	N/A	N/A	N/A	hinuntersteigend; abweichend; abstammend	N/A	of offspring, descending from the family of -; moving downward	descendant de, provenant de; originaire de	discendente	子孫の; 降下する	N/A	iemand die naar beneden gaat; afstammeling	descendente, que desce; que descende de-, originário de-, cuja origem é-	N/A	descendiente	härstammande; ättling, avkomling, avkomma	ซึ่งสืบทอดมา ซึ่งสืบเชื้อสายมา	N/A
descriptor	N/A	57716	16580		N/A	N/A	N/A	N/A	N/A	N/A	N/A	N/A	N/A	N/A	N/A	N/A	N/A	N/A	N/A	N/A	N/A	N/A
destination	n.	7359	2522	dˌɛstənˈeɪʃən	destinations	N/A	المكان المقصود, مكان الوصول, غاية, طية, غرض, تخصيص, أصل	目的地, 目标, 目的	Ziel, Ziel der Wünsche	προορισμός	place where one is going, place where something is sent	destination	destinazione, meta	目的地; 仕向先; 目的; 予定	목적, 목적지	doel, bestemming	destinação, destino, objetivo	место назначения, пункт назначения, цель, адресат, получатель, назначение, предназначение	destinación, destino, rumbo	destination, mål	จุดหมายปลายทาง หลักชัย, จุดหมาย, เป้าหมาย, ที่หมาย	istikamet, varış yeri, gidilecek yer; hedef, amaç; nereye
detection	n.	8951	4058	dɪtˈɛkʃən	detections	N/A	اكتشاف, تحرى, كشف	发现, 察觉, 探测	Entdeckung, Entblößung	ανακάλυψη, ανίχνευση	discovery, act of detecting, finding out; fact of being detected; demodulation, act or process of separating a modulated message from the carrier signal (Computers, Telecommunications)	découverte, détection	scoperta; (Rad) raddrizzamento	発見; 発覚	발견, 찾아냄	ontdekking, openbaring	detecção, descobrimento	открытие, обнаружение, выявление, расследование, детектирование	detección	upptäckt, uppdagande	การค้นหา	buluş, keşif, bulma; suçluyu ortaya çıkarma; demodülasyon [rad.]
developmental	adv.	11460	7430	dɪvˌɛləpmˈɛntəl	N/A	N/A	N/A	N/A	N/A	N/A	N/A	N/A	N/A	N/A	N/A	N/A	N/A	N/A	N/A	N/A	N/A	N/A
deviation	n.	12741	9090	dˌiviˈeɪʃən	deviations	N/A	انحراف, إنحراف الضوء, إنحراف أخلاقى, إنحراف عن الخط الحزبى المقرر, الانحراف	背离	Abweichung, Deviation	παρεκτροπή, παρέκκλιση	act of deviating; aberration, abnormality; divergence	déviation, écart (de la norme), perversion	deviazione; scostamento, scarto	外れること; 偏差; 自差	탈선; 일탈, 일탈행위; 벗어남	afwijking, uitzondering	desvio, tangenciamento	отклонение, отступление, отступное; уклон [полит.], девиация; отклонение от договоренного рейса	desviación, desvío, disgresión; aberración, desavío, descarrío, divergencia	avvikelse, avdrift	ความไม่เห็นพ้อง ความคิดแตกต่าง, การเข้ากันไม่ได้	sapma, ayrılma
diagnose	v.	30491	14460	dˌaɪəgnˈoʊs	diagnoses diagnosed diagnosing	analyze identify detect spot establish	شخص	N/A	diagnostizieren, feststellen (einer Krankheit)	διαγιγνώσκω, κάνω διάγνωση	examine and identify a disease from its symptoms, draw conclusions from a diagnostic exam	constater, diagnostiquer (discernement d'une maladie)	diagnosticare	診断する; 診察する; 原因を突きとめる	증세로 병을 진단하다, 증세로 결과를 도출해내다	een diagnose stellen	diagnosticar, fazer o diagnóstico de (conhecimento duma doença pelos seus sintomas)	ставить диагноз, диагностировать, распознавать	diagnosticar, dictaminar, hacer un diagnóstico sobre	diagnostisera, ställa diagnos på	N/A	teşhis etmek, tanımlamak, hakkında bilgi vermek
diagnosis	n.	5444	4221	dˌaɪəgnˈoʊsəs	diagnoses	N/A	تشخيص الداء	诊断	Diagnose, Feststellung (einer Krankheit)	διάγνωση	process of identifying a disease from its symptoms, conclusion following a diagnostic exam	diagnostic, critère	diagnosi	診断; 診察; 調査; 判断	진단, 진단법	diagnose	diagnose	диагноз, точное определение, оценка, диагностика	diagnóstico, diagnosis, dictamen médico	diagnos	การวินิจฉัยโรค การหาสาเหตุ	teşhis, tanı, belirtme, gösterme
diagnostic	adj.	10641	5758	dˌaɪəgnˈɑstɪk	N/A	N/A	تشخيصي	N/A	diagnostisch, feststellend	διαγνωστικός	relating to or used in diagnosis, relating to or used in the identification of a disease from its symptoms	diagnostique (du diagnostic de maladies)	diagnostico	診断の; 診察の; 診断に役立つ; 症状を示す	진단상의	diagnostisch (v. d. diagnose)	diagnóstico (conhecimento duma doença pelos seus sintomas)	диагностический	diagnóstico	diagnostisk, angående diagnos	ซึ่งใช้ในการวินิจฉัยโรค ซึ่งใช้ในการหาสาเหตุ	teşhisle ilgili
diagram	n.	6719	6434	dˈaɪəgrˌæm	diagrams diagramed diagrammed diagraming diagramming	N/A	رسم بياني, خط بياني	N/A	Entwurf, Diagramm	διάγραμμα, σχηματική παράσταση	drawing which accompanies an explanation; chart, plan	diagramme, schéma, graphique, courbe, croquis, esquisse	diagramma, grafico; schema	図表; 図解; 図形; 図式	도표, 설명이 있는 그림; 계획표, 일람표	ontwerp, schets, diagram	diagrama	диаграмма, график, схема, объяснительный чертеж, эпюр	diagrama, croquis, esquema, plano, trazado	diagram, schematisk teckning	N/A	diyagram, şema, taslak
dialect	n.	15443	23103	dˈaɪəlˌɛkt	dialects	N/A	لهجة محلية, لغة محلية, لغة متفرعة من لغة أم, لغة بلد ما, لهجة, اللهجة المميزة لإقليم أو جماعة	方言, 同源语	Spracheigentümlichkeit, Dialekt	διάλεκτος, ιδίωμα	form of a language spoken in a certain area or district; subordinate variety of a language	parole; dialecte	(Ling) dialetto; lingua; gergo	方言; 通用語; 訛り	방언, 사투리, 어떤 특정한 지역에서만 씌이는 말의 형태; 어파, 어떤 언어의 종속어	gezegde, uitdrukking; accent,dialekt	dialeto	диалект, наречие, говор	dialecto	dialekt, bygdemål	ภาษาถิ่น ภาษาท้องถิ่น, ภาษาพื้นเมือง	lehçe, ağız, diyalekt
diameter	n.	7389	5387	daɪˈæmətɜ	diameters	N/A	قطر الدائرة	直径	Diameter, Durchmesser	διάμετρος	length of a central line which extends from one side of an object to its opposite side	diamètre	diametro	直径; 倍; 倍率	지름, 한가운데를 가로 지르는 선	diameter, doorsnede	diâmetro	диаметр, поперечник	diámetro	diameter	เส้นผ่าศูนย์กลาง เส้นผ่านศูนย์กลางของวงกลม	çap, en, kalınlık
diary	n.	4580	4585	dˈaɪɜi	diaries	N/A	جريدة, دفتر لتدوين الملاحظات, ملاحظة	日记	Tagebuch	ημερολόγιο συμβάντων, ημερολόγιο	written account of daily occurrences, journal; daily calendar	journal intime, agenda	diario; agenda	日記; 日記帳	일기, 일기장; 일지	dagboek; agenda	diário	дневник, записная книжка, записная книжка-календарь	diario, agenda	dagbok	สมุดบันทึก ไดอารี่, บันทึกประจำวัน	günlük, hatıra defteri, ajanda; jurnal
dictate	v.	20335	20831	dɪktˈeɪt	dictates dictated dictating	N/A	أمر, أملى, أملى أوامره	N/A	diktieren, vorschreiben	προστάζω, υπαγορεύω, διατάσσω	say (something) aloud for someone to write down; command, order	dicter	dettare; imporre; richiedere	書き取らせる; 命令する; 口述する	받아 쓰게 하다; 명령하다	dicteren	ditar	диктовать, продиктовать, предписывать	dictar, estipular, fijar; mandar	diktera	N/A	dikte etmek, söyleyerek yazdırmak; zorla kabul ettirmek, emretmek, etkilemek; belirlemek
dictionary	n.	4931	1984	dˈɪkʃənˌɛri	dictionaries	thesaurus vocabulary glossary lexicon	قاموس, معجم	字典, 词典	Wörterbuch	λεξικό	reference source which provides information on a given list of terms (i.e. translations, meanings, spelling, pronunciation, etc.); list of items with corresponding information used for reference	dictionnaire	dizionario, vocabolario, lessico	辞書	사전, 단어에 대한 뜻 또는 쓰임을 제공하는 참고책	woordenboek	dicionário	словарь, справочник	diccionario, léxico, lexicón	ordbok	พจนานุกรม ปทานุกรม, นามานุกรม, ประมวลคำศัพท์, อภิธานคำศัพท์	sözlük; ansiklopedik sözlük
differential	adj.	9283	6912	dˌɪfɜˈɛnʃəl	N/A	N/A	تفاوتي, تخالفي, تبايني, مميز	N/A	unterschiedlich; abgestuft; Differential-	N/A	exhibiting a difference; pertaining to small differences (Mathematics); pertaining to the difference of two or more motions	changeant; différent; différentiel	differenziale	差のある（数学）; 他と異なる; 差異に基づく; 差動の	차이의, 구별의, 차별적인; 미분의(수학); 차동의	veranderbaar; verschillend; differentiaal	diferencial; diferente	отличительный, дифференциальный	diferencial	differentiell; skärskiljande; differential-	ซึ่งมีความแตกต่างกัน ก่อให้เกิด	ayrımcı, ayrım yapan, ayrımsal, diferansiyel; farklı olan; kademeli
differentiate	v.	16585	17786	dˌɪfɜˈɛnʃiˌeɪt	differentiates differentiated differentiating	N/A	ميز, فرق ( بين ), ميز بين, تخلق, تخالف, خلق, تميز	N/A	differenzieren, unterscheiden	διακρίνω, κάνω διάκριση, διαφοροποιώ, διαφέρω	distinguish, discriminate; become different; transform into a derivative (Mathematics)	différencier	differenziare, distinguere, rendere differente; fare differenza tra, discriminare, distinguere tra	区別する; 差別する; （数学）差を出す	구별 짓다; 구별하다,차별하다; 미분하다(수학)	onderscheiden	diferenciar, distinguir	отличать, различать, разграничивать, видоизменяться, дифференцировать	diferenciar, discriminar, distinguir	särskilja	N/A	farklılaştırmak, ayırdetmek, ayırt etmek, farkı görmek, ayrım yapmak, fark gözetmek
